LUX;Luxembourg;Quintile supérieur de la satisfaction à l’égard de la vie;Quintile supérieur de la satisfaction à l’égard de la vie;FCTR_Q1_SCR_LIFE_SATISFACTION;Facteur de quintile de satisfaction à l'égard de la vie les plus bas;HSL_11;Bien-être subjectif;;;;;;;;;;2,0671159567;;;;;1,9112007793;;;2,0482350926;2,2984755373;2,1900020704;2,2104089477;
LUX;Luxembourg;Quintile supérieur de la satisfaction à l’égard des relations personnelles;Quintile supérieur de la satisfaction à l’égard des relations personnelles;FCTR_Q1_SCR_PERS_REL_SATISFACTION;Facteur de quintile de satisfaction des relations personnelle les plus bas;HSL_7;Liens sociaux;;;;;;;;;;1,8028840889;;;;;1,8508040879;;;;2,2170115788;;;
LUX;Luxembourg;Quintile supérieur de la satisfaction à l’égard de l’emploi du temps;Quintile supérieur de la satisfaction à l’égard de l’emploi du temps;FCTR_Q1_SCR_TIME_USE;Facteur de quintile de satisfaction à l'égard de l'utilisation du temps les plus bas;HSL_4;Equilibre travail-vie;;;;;;;;;;2,6812361359;;;;;2,5995089956;;;;3,3626189261;;;
LUX;Luxembourg;Satisfaction à l’égard de la vie;Satisfaction à l’égard de la vie;0_TO_10;Échelle 0-10;HSL_11;Bien-être subjectif;;;;;;;;;;7,4342386137;;;;;7,5563322403;;;7,4221141231;7,2097825661;7,2504849558;7,2028519607;
LUX;Luxembourg;Satisfaction à l’égard de l’emploi du temps;Satisfaction à l’égard de l’emploi du temps;0_TO_10;Échelle 0-10;HSL_4;Equilibre travail-vie;;;;;;;;;;7,1794572164;;;;;7,0255254967;;;;6,5356269949;;;
LUX;Luxembourg;Satisfaction à l’égard des relations personnelles;Satisfaction à l’égard des relations personnelles;0_TO_10;Échelle 0-10;HSL_7;Liens sociaux;;;;;;;;;;7,9990261710;;;;;7,8129933039;;;;7,5860315069;;;
LUX;Luxembourg;Satisfaction à l’égard des relations personnelles inférieure à 5;Satisfaction à l’égard des relations personnelles inférieure à 5;PT_POP_Y_GE16;Pourcentage de la population âgée de 16 ans ou plus;HSL_7;Liens sociaux;;;;;;;;;;3,6103793417;;;;;3,8427463157;;;;7,4157913193;;;
LUX;Luxembourg;Satisfaction à l’égard de l’emploi du temps inférieure à 5;Satisfaction à l’égard de l’emploi du temps inférieure à 5;PT_POP_Y_GE16;Pourcentage de la population âgée de 16 ans ou plus;HSL_4;Equilibre travail-vie;;;;;;;;;;12,1415830887;;;;;12,1868184652;;;;17,2616454054;;;
LUX;Luxembourg;Satisfaction à l’égard de la vie inférieure à 5;Satisfaction à l’égard de la vie inférieure à 5;PT_POP_Y_GE16;Pourcentage de la population âgée de 16 ans ou plus;HSL_11;Bien-être subjectif;;;;;;;;;;5,8445589708;;;;;4,2531310557;;;5,7760323758;7,8685702941;8,1028575130;8,2058129739;
LUX;Luxembourg;Satisfaction au travail;Satisfaction au travail;0_TO_10;Échelle 0-10;HSL_2;Travail et qualité de l'emploi;;;;;;;;;;7,4754567325;;;;;7,2955495801;;;;;7,1808641119;;
LUX;Luxembourg;Écart entre les genres en termes de temps de travail;Écart entre les genres en termes de temps de travail;MN_D;Minutes par jour;HSL_4;Equilibre travail-vie;;;;;;;;;;;27,5399409876;;;;;;;;;;;
LUX;Luxembourg;Cas autodéclarés de dépression;Cas autodéclarés de dépression;PT_POP_Y_GE15;Pourcentage de la population âgée de 15 ans ou plus;HSL_5;Santé;;;;;;;;;;;8,3000000000;;;;;8,3000000000;;;;;;
LUX;Luxembourg;Quintile supérieur du revenu disponible moyen des ménages;Quintile supérieur du revenu disponible moyen des ménages;FCTR_Q1_INC;Facteur de quintile des revenus les plus bas;HSL_1;Revenu et patrimoine;;;;;;;;;;;;4,8559395459;4,8846876967;5,5899042288;5,2149155304;4,7701173438;4,4424107519;4,4325860196;4,5166635756;;;
LUX;Luxembourg;Revenu disponible des ménages inférieur au seuil de pauvreté monétaire relative;Revenu disponible des ménages inférieur au seuil de pauvreté monétaire relative;PT_POP;Pourcentage de la population;HSL_1;Revenu et patrimoine;;;;;;;;;;;;10,9206389713;11,1357464512;12,1710460691;11,3680758227;10,4995528247;9,8470547815;9,5861858163;8,8835320476;;;
LUX;Luxembourg;Décile supérieur des résultats en compréhension de l’écrit;Décile supérieur des résultats en compréhension de l’écrit;FCTR_D1_SCR;Facteur de décile des scores les plus bas;HSL_6;Savoirs et compétences;;;;;;;;;;;;;;;1,8817318678;;;;;;;
LUX;Luxembourg;Décile supérieur des résultats en mathématiques;Décile supérieur des résultats en mathématiques;FCTR_D1_SCR;Facteur de décile des scores les plus bas;HSL_6;Savoirs et compétences;;;;;;;;;;;;;;;1,7280256748;;;;;;;
LUX;Luxembourg;Décile supérieur des résultats en sciences;Décile supérieur des résultats en sciences;FCTR_D1_SCR;Facteur de décile des scores les plus bas;HSL_6;Savoirs et compétences;;;;;;;;;;;;;;;1,7438099384;;;;;;;
LUX;Luxembourg;Faible compétences dans les trois domaines évalués par le PISA;Faible compétences dans les trois domaines évalués par le PISA;PT_ST;Pourcentage de dépenses chez le même prestataire;HSL_6;Savoirs et compétences;;;;;;;;;;;;;;;17,4126372295;;;;;;;
LUX;Luxembourg;Sentiment de solitude;Sentiment de solitude;PT_POP_Y_GE16;Pourcentage de la population âgée de 16 ans ou plus;HSL_7;Liens sociaux;;;;;;;;;;;;;;;4,9478242718;;;;4,8505876493;;;
LUX;Luxembourg;Avoir son mot à dire concernant l’action des pouvoirs publics;Avoir son mot à dire concernant l’action des pouvoirs publics;PT_POP_Y16T65;Pourcentage de la population âgée de 16 à 65 ans;HSL_8;Engagement civique;;;;;;;;;;;;;;;;;;33,7879870000;;28,8269030000;;
LUX;Luxembourg;Ne pas avoir son mot à dire concernant l’action des pouvoirs publics;Ne pas avoir son mot à dire concernant l’action des pouvoirs publics;PT_POP_Y16T65;Pourcentage de la population âgée de 16 à 65 ans;HSL_8;Engagement civique;;;;;;;;;;;;;;;;;;46,6035910000;;51,6208250000;;
LVA;Lettonie;Accessibilité financière du logement;Accessibilité financière du logement;PT_B7G_S14;Pourcentage du revenu disponible brut ajusté des ménages;HSL_3;Logement;85,2180817656;85,5614983021;84,4707390426;83,6493473056;83,9150457464;82,7574247828;81,6038251422;81,1512509874;80,6231798758;80,8437548406;80,8495901583;81,6942557163;82,1557092352;82,8789866227;83,1879837748;83,5827348841;83,4087906893;83,0756147715;82,0021702287;82,4704275093;83,6570063128;
LVA;Lettonie;Quintile supérieur du revenu disponible moyen des ménages;Quintile supérieur du revenu disponible moyen des ménages;FCTR_Q1_INC;Facteur de quintile des revenus les plus bas;HSL_1;Revenu et patrimoine;6,7944981999;7,9168160826;6,3181308676;7,3984446057;7,3888234314;6,5262794187;6,2002610872;6,2347959954;6,1368152361;6,3147288177;6,3595481407;6,3327340312;6,4130649447;6,7011200326;6,6024175531;6,2341520663;6,6799950447;6,3152770471;6,2489259074;6,2331790924;;
LVA;Lettonie;Espérance de vie à la naissance;Espérance de vie à la naissance;Y;Années;HSL_5;Santé;70,9000000000;70,6000000000;70,6000000000;70,8000000000;72,1000000000;72,8000000000;73,1000000000;73,9000000000;74,1000000000;74,3000000000;74,5000000000;74,8000000000;74,9000000000;74,9000000000;75,1000000000;75,7000000000;75,5000000000;73,1000000000;74,5000000000;75,6000000000;;
LVA;Lettonie;Décès dus au suicide, à l’alcool ou à la drogue;Décès dus au suicide, à l’alcool ou à la drogue;DT_10P5HB;Décès pour 100 000 d'habitants;HSL_5;Santé;42,0853359178;43,4598809924;45,2305487563;41,9789038361;53,0978152867;50,6307127101;47,7513521372;45,7604971244;47,3312285832;43,8444288274;44,0573337848;45,1636834873;42,1682931843;39,5602723151;41,1048336620;36,9560322002;35,1611885251;44,2154193585;44,0389230904;44,0330848519;;
LVA;Lettonie;Mortalité routière;Mortalité routière;DT_10P5HB;Décès pour 100 000 d'habitants;HSL_10;Sécurité;22,8003616200;19,7427281300;18,3469117000;19,0426414300;14,5132415000;11,8599092600;10,3930528600;8,6905480340;8,7007003330;8,8937603070;10,6330581800;9,5068234210;8,0631291980;7,0021953940;7,8353070350;7,0539475460;7,4192993340;7,7474542180;6,0126115860;7,5461671320;;
LVA;Lettonie;Homicides;Homicides;DT_10P5HB;Décès pour 100 000 d'habitants;HSL_10;Sécurité;9,7000000000;10,3000000000;9,8000000000;8,6000000000;7,8000000000;6,5000000000;6,4000000000;6,1000000000;6,2000000000;5,8000000000;6,7000000000;4,9000000000;4,4000000000;3,6000000000;3,8000000000;3,2000000000;3,3000000000;3,4000000000;2,9000000000;2,4000000000;;
LVA;Lettonie;Revenu disponible des ménages inférieur au seuil de pauvreté monétaire relative;Revenu disponible des ménages inférieur au seuil de pauvreté monétaire relative;PT_POP;Pourcentage de la population;HSL_1;Revenu et patrimoine;14,1678203355;17,5956725044;14,5675005042;18,6399986121;19,1254151464;14,1350202960;13,3417479285;12,9386700696;13,3335586424;14,5293968441;16,4289931477;16,2232323526;16,7176071472;16,5653972103;17,4814054937;16,2223640483;16,8688387202;15,9818033989;16,8627566110;16,1653400000;;
LVA;Lettonie;Exposition à la pollution de l’air;Exposition à la pollution de l’air;PT_POP;Pourcentage de la population;HSL_9;Qualité environnementale;99,8492360000;99,8495100000;99,8497310000;99,8499680000;99,8502040000;99,8504490000;99,8507000000;99,8514400000;99,8521960000;99,8529740000;99,8537600000;99,8545680000;99,8550260000;99,8554920000;99,8559720000;99,8564530000;99,8569490000;;;;;
LVA;Lettonie;Exposition à des températures extrêmes;Exposition à des températures extrêmes;PT_POP;Pourcentage de la population;HSL_9;Qualité environnementale;0,0000000000;0,0000000000;0,0000000000;0,0000000000;0,0000000000;0,0000000000;0,0000000000;0,0000000000;0,0000000000;0,0000000000;0,0000000000;0,0000000000;0,0000000000;0,0000000000;0,0000000000;0,0000000000;0,0000000000;0,0000000000;0,0000000000;0,0000000000;;
LVA;Lettonie;Jeunes sans emploi et sortis du système éducatif;Jeunes sans emploi et sortis du système éducatif;PT_POP_Y15T24;Pourcentage de la population âgée de 15 à 24 ans;HSL_2;Travail et qualité de l'emploi;14,5604710000;12,9528220000;11,3173690000;11,4706640000;10,1340670000;17,6717970000;19,4615800000;15,2987930000;14,7145390000;11,5936650000;11,3421430000;9,0240812000;11,9014210000;11,9740560000;8,5120964000;8,1775236000;9,4070539000;10,8700000000;8,4470682000;9,6661644000;7,7714490891;
LVA;Lettonie;Taux de chômage de longue durée;Taux de chômage de longue durée;PT_LF;Pourcentage des dépenses de santé;HSL_2;Travail et qualité de l'emploi;5,0246061026;4,5281524397;2,4431987374;1,6763112978;1,9253509010;4,6306997875;8,9147935442;9,0054682390;7,9889432838;5,8809940597;4,8382381253;4,5751536659;4,1168135739;3,3588096804;3,1587697696;2,4742625261;2,2951564895;2,3770462410;2,0503735960;1,8688984619;2,3389637822;
LVA;Lettonie;Horaires de travail lourds;Horaires de travail lourds;PT_SAL;Pourcentage de salariés;HSL_2;Travail et qualité de l'emploi;11,9500000000;11,2400000000;11,2100000000;8,1700000000;5,7600000000;4,4900000000;2,5000000000;2,2800000000;2,5600000000;2,2800000000;2,4500000000;2,3500000000;2,2800000000;1,7500000000;1,7200000000;1,3900000000;1,6500000000;0,8700000000;0,7800000000;0,6900000000;0,4900000000;
LVA;Lettonie;Taux d’emploi;Taux d’emploi;PT_POP_Y25T64;Pourcentage de la population âgée de 25 à 64 ans;HSL_2;Travail et qualité de l'emploi;69,9020000000;70,8840000000;74,9200000000;76,9680000000;77,2750000000;69,5100000000;67,2170000000;69,4620000000;70,8620000000;72,5010000000;72,9270000000;74,3840000000;75,1330000000;76,4350000000;78,2260000000;79,0090000000;78,6420000000;77,0750000000;78,5780000000;79,0890000000;79,1710000000;
LVA;Lettonie;Salaire brut annuel moyen;Salaire brut annuel moyen;USD_PPP;Dollars des É-U, PPA convertis;HSL_2;Travail et qualité de l'emploi;18196,4910000000;21165,6930000000;23338,0730000000;28773,9800000000;29681,9960000000;26801,8120000000;25768,0080000000;24870,6880000000;25876,3730000000;27119,2930000000;28938,0410000000;31375,1860000000;33233,5570000000;34420,1150000000;35685,6620000000;37147,5650000000;38610,6040000000;40614,7930000000;40273,1320000000;42274,9510000000;45566,5160000000;
LVA;Lettonie;Revenu disponible ajusté net des ménages et des ISBLSM par habitant;Revenu disponible ajusté net des ménages et des ISBLSM par habitant;USD_PPP_PS;Dollars des É-U par personne, PPA convertis;HSL_1;Revenu et patrimoine;13374,0000000000;14949,0000000000;17426,0000000000;19072,0000000000;19897,0000000000;16749,0000000000;16464,0000000000;16110,0000000000;16972,0000000000;17591,0000000000;18414,0000000000;19541,0000000000;20598,0000000000;21524,0000000000;22633,0000000000;22979,0000000000;23164,0000000000;24265,0000000000;23545,0000000000;23066,0000000000;23983,0000000000;
LVA;Lettonie;Ménages disposant d’un accès internet;Ménages disposant d’un accès internet;PT_HH;Pourcentage de ménages;HSL_3;Logement;;13,9319000000;22,5044000000;31,9235000000;39,6576000000;50,2337000000;52,5646000000;59,3778000000;67,2844000000;70,1288000000;73,0891000000;74,3762000000;75,0844000000;76,4973000000;78,7898000000;83,3023000000;87,5546000000;89,4787000000;;;;
LVA;Lettonie;Incapacité à maintenir le logement à bonne température;Incapacité à maintenir le logement à bonne température;PT_POP_Y_GE16;Pourcentage de la population âgée de 16 ans ou plus;HSL_3;Logement;;29,8000000000;25,7000000000;20,9000000000;16,8000000000;16,4000000000;19,1000000000;22,5000000000;19,9000000000;21,1000000000;16,8000000000;14,5000000000;10,6000000000;9,7000000000;7,5000000000;8,0000000000;6,0000000000;4,9000000000;7,1000000000;6,6000000000;4,9000000000;
LVA;Lettonie;Difficultés à joindre les deux bouts;Difficultés à joindre les deux bouts;PT_POP_Y_GE16;Pourcentage de la population âgée de 16 ans ou plus;HSL_1;Revenu et patrimoine;;52,1000000000;46,8000000000;39,9000000000;39,8000000000;48,0000000000;56,0000000000;57,0000000000;52,1000000000;54,4000000000;49,0000000000;42,7000000000;39,3000000000;40,5000000000;32,1000000000;25,0000000000;24,2000000000;20,1000000000;23,9000000000;24,0000000000;23,3000000000;
LVA;Lettonie;État de santé perçu comme bon;État de santé perçu comme bon;PT_POP_Y_GE16;Pourcentage de la population âgée de 16 ans ou plus;HSL_5;Santé;;35,0000000000;40,4000000000;42,5000000000;43,5000000000;46,0000000000;47,8000000000;46,0000000000;46,7000000000;45,2000000000;45,8000000000;46,2000000000;47,2000000000;44,2000000000;46,9000000000;47,1000000000;49,7000000000;49,8000000000;50,2000000000;47,6000000000;49,0000000000;
LVA;Lettonie;État de santé perçu comme mauvais;État de santé perçu comme mauvais;PT_POP_Y_GE16;Pourcentage de la population âgée de 16 ans ou plus;HSL_5;Santé;;21,7000000000;20,0000000000;19,1000000000;18,0000000000;16,8000000000;17,5000000000;17,7000000000;15,4000000000;16,8000000000;17,2000000000;16,3000000000;15,7000000000;16,9000000000;15,5000000000;15,4000000000;13,7000000000;13,1000000000;14,2000000000;15,7000000000;15,1000000000;
LVA;Lettonie;Tension au travail;Tension au travail;PT_SAL;Pourcentage de salariés;HSL_2;Travail et qualité de l'emploi;;37,4540748596;;;;;34,1117401123;;;;;30,2934017181;;;;;;;;;;
LVA;Lettonie;Compétences des élèves en compréhension de l’écrit;Compétences des élèves en compréhension de l’écrit;PO;Points;HSL_6;Savoirs et compétences;;;479,4918354322;;;483,9601454348;;;488,6944140807;;;487,7580985436;;;478,6986741576;;;;474,5700000000;;;
LVA;Lettonie;Compétences des élèves en sciences;Compétences des élèves en sciences;PO;Points;HSL_6;Savoirs et compétences;;;489,5437781706;;;493,8789239042;;;502,1861936449;;;490,2250183610;;;487,2505882194;;;;493,8400000000;;;
LVA;Lettonie;Compétences des élèves en mathématiques;Compétences des élèves en mathématiques;PO;Points;HSL_6;Savoirs et compétences;;;486,1660834645;;;481,9538221213;;;490,5710218344;;;482,3050717003;;;496,1263306225;;;;483,1600000000;;;
LVA;Lettonie;Participation électorale;Participation électorale;PT_VOTES;Pourcentage des votes;HSL_8;Engagement civique;;;60,9800000000;;;;64,7200000000;59,4900000000;;;58,8000000000;;;;54,5800000000;;;;59,4300000000;;;
LVA;Lettonie;Bilan émotionnel négatif;Bilan émotionnel négatif;PT_POP_Y_GE15;Pourcentage de la population âgée de 15 ans ou plus;HSL_11;Bien-être subjectif;;;16,7427245571;16,7427245571;18,5803700472;18,5803700472;;16,5686758266;16,5686758266;16,5686758266;17,1516498826;17,1516498826;17,1516498826;17,3102307445;17,3102307445;17,3102307445;11,6863260549;11,6863260549;13,7680127618;13,7680127618;;
LVA;Lettonie;Douleur physique;Douleur physique;PT_POP_Y_GE15;Pourcentage de la population âgée de 15 ans ou plus;HSL_11;Bien-être subjectif;;;19,0000000000;19,0000000000;23,0000000000;23,0000000000;;24,3333333333;24,3333333333;24,3333333333;24,3333333333;24,3333333333;24,3333333333;21,6666666667;21,6666666667;21,6666666667;21,0000000000;21,0000000000;21,0000000000;29,5000000000;29,5000000000;
LVA;Lettonie;Sentiment d’insécurité la nuit;Sentiment d’insécurité la nuit;PT_POP_Y_GE15;Pourcentage de la population âgée de 15 ans ou plus;HSL_10;Sécurité;;;47,5000000000;47,5000000000;43,0000000000;43,0000000000;;39,0000000000;39,0000000000;39,0000000000;30,6666666667;30,6666666667;30,6666666667;30,6666666667;30,6666666667;30,6666666667;19,3333333333;19,3333333333;19,3333333333;19,5000000000;19,5000000000;
LVA;Lettonie;Sentiment de sécurité la nuit;Sentiment de sécurité la nuit;PT_POP_Y_GE15;Pourcentage de la population âgée de 15 ans ou plus;HSL_10;Sécurité;;;47,0000000000;47,0000000000;48,5000000000;48,5000000000;;54,0000000000;54,0000000000;54,0000000000;61,0000000000;61,0000000000;61,0000000000;60,0000000000;60,0000000000;60,0000000000;74,6666666667;74,6666666667;74,6666666667;74,5000000000;74,5000000000;
LVA;Lettonie;Soutien social;Soutien social;PT_POP_Y_GE15;Pourcentage de la population âgée de 15 ans ou plus;HSL_7;Liens sociaux;;;82,4862754000;82,4862754000;80,0195591047;80,0195591047;;81,2806697292;81,2806697292;81,2806697292;85,8489332250;85,8489332250;85,8489332250;88,0540460840;88,0540460840;88,0540460840;92,9118950524;92,9118950524;92,9118950524;91,9698688846;91,9698688846;
LVA;Lettonie;Manque de soutien social;Manque de soutien social;PT_POP_Y_GE15;Pourcentage de la population âgée de 15 ans ou plus;HSL_7;Liens sociaux;;;13,4308777860;13,4308777860;16,2631649579;16,2631649579;;15,4302951458;15,4302951458;15,4302951458;10,3242463018;10,3242463018;10,3242463018;8,2120636057;8,2120636057;8,2120636057;6,2746366315;6,2746366315;6,2746366315;6,0498157686;6,0498157686;
LVA;Lettonie;Salariés à temps plein dont la rémunération est inférieure à deux tiers du salaire brut médian;Salariés à temps plein dont la rémunération est inférieure à deux tiers du salaire brut médian;PT_SAL_FT;Pourcentage de salariés à plein temps;HSL_2;Travail et qualité de l'emploi;;;30,0476190500;;;;22,0000000000;;;;21,6666666700;;;;21,9333333300;;;;21,3067322800;20,1160295300;;
LVA;Lettonie;Écart de rémunération entre les genres;Écart de rémunération entre les genres;PT_WG_SAL_M_D;Pourcentage du salaire des hommes dans le même décile;HSL_2;Travail et qualité de l'emploi;;;8,4656084660;;;;19,0556492400;;;;21,1229946500;;;;20,2898550700;;;;19,5522388100;18,4120282900;;
LVA;Lettonie;Décile supérieur de la rémunération des salariés à temps plein;Décile supérieur de la rémunération des salariés à temps plein;FCTR_D1_EARN;Facteur de décile des gains les plus bas;HSL_2;Travail et qualité de l'emploi;;;5,9861111110;;;;4,4769230770;;;;4,0000000000;;;;4,0795918370;4,0877421760;4,0672108370;4,5081512310;4,1008130080;4,3718962660;;
LVA;Lettonie;Insécurité sur le marché du travail;Insécurité sur le marché du travail;PT_EARN_PRVS_LST;Pourcentage des gains antérieurs perdus;HSL_2;Travail et qualité de l'emploi;;;;3,5143427849;5,4292230606;12,4797859192;14,6183357239;13,3420486450;12,5297546387;9,1713323593;7,8563675880;6,6959462166;6,2852816582;;;;;;;;;
LVA;Lettonie;Ménages vivant dans des logements surpeuplés;Ménages vivant dans des logements surpeuplés;PT_HH;Pourcentage de ménages;HSL_3;Logement;;;;;;;46,8481928110;34,0795755386;27,6164889336;29,1428595781;31,0987293720;32,4794262648;33,7536126375;32,6821327209;34,2069059610;33,1455767155;33,9861363173;32,5011432171;32,8301042318;32,8792124987;31,5735489130;
LVA;Lettonie;Surcharge financière liée au coût du logement;Surcharge financière liée au coût du logement;PT_POP;Pourcentage de la population;HSL_3;Logement;;;;;;;10,6892921031;11,8648372591;13,8773277402;8,1860736012;8,7024986744;7,6207786798;7,1777321398;7,8827269375;7,1953885257;5,3415812552;6,8632751703;6,6599868238;7,3663823307;;;
LVA;Lettonie;Accès à des espaces verts;Accès à des espaces verts;PT_POP_URB;Pourcentage de population urbaine;HSL_9;Qualité environnementale;;;;;;;;;68,4944784101;;;;;;68,8758394526;;;;;;;
LVA;Lettonie;Quintile supérieur de la satisfaction à l’égard de la vie;Quintile supérieur de la satisfaction à l’égard de la vie;FCTR_Q1_SCR_LIFE_SATISFACTION;Facteur de quintile de satisfaction à l'égard de la vie les plus bas;HSL_11;Bien-être subjectif;;;;;;;;;;2,5440854517;;;;;2,3299177203;;;2,1396387266;2,1307432195;2,1734135453;2,0411095156;
LVA;Lettonie;Quintile supérieur de la satisfaction à l’égard des relations personnelles;Quintile supérieur de la satisfaction à l’égard des relations personnelles;FCTR_Q1_SCR_PERS_REL_SATISFACTION;Facteur de quintile de satisfaction des relations personnelle les plus bas;HSL_7;Liens sociaux;;;;;;;;;;1,7460520286;;;;;1,9245682029;;;;1,8273305389;;;
LVA;Lettonie;Quintile supérieur de la satisfaction à l’égard de l’emploi du temps;Quintile supérieur de la satisfaction à l’égard de l’emploi du temps;FCTR_Q1_SCR_TIME_USE;Facteur de quintile de satisfaction à l'égard de l'utilisation du temps les plus bas;HSL_4;Equilibre travail-vie;;;;;;;;;;2,2798002640;;;;;2,3327184763;;;;2,0827363475;;;
LVA;Lettonie;Satisfaction à l’égard de la vie;Satisfaction à l’égard de la vie;0_TO_10;Échelle 0-10;HSL_11;Bien-être subjectif;;;;;;;;;;6,4682794765;;;;;6,7377044739;;;6,7447419244;6,8309621773;6,8686552316;6,9321224340;
LVA;Lettonie;Satisfaction à l’égard de l’emploi du temps;Satisfaction à l’égard de l’emploi du temps;0_TO_10;Échelle 0-10;HSL_4;Equilibre travail-vie;;;;;;;;;;7,0884388443;;;;;6,9996752228;;;;7,2389306617;;;
LVA;Lettonie;Satisfaction à l’égard des relations personnelles;Satisfaction à l’égard des relations personnelles;0_TO_10;Échelle 0-10;HSL_7;Liens sociaux;;;;;;;;;;8,0792536176;;;;;7,7532103502;;;;7,9395307198;;;
LVA;Lettonie;Satisfaction à l’égard des relations personnelles inférieure à 5;Satisfaction à l’égard des relations personnelles inférieure à 5;PT_POP_Y_GE16;Pourcentage de la population âgée de 16 ans ou plus;HSL_7;Liens sociaux;;;;;;;;;;2,3649109874;;;;;3,1779357626;;;;3,3244209789;;;
LVA;Lettonie;Satisfaction à l’égard de l’emploi du temps inférieure à 5;Satisfaction à l’égard de l’emploi du temps inférieure à 5;PT_POP_Y_GE16;Pourcentage de la population âgée de 16 ans ou plus;HSL_4;Equilibre travail-vie;;;;;;;;;;7,8335922237;;;;;9,2696347427;;;;5,3371695779;;;
LVA;Lettonie;Satisfaction à l’égard de la vie inférieure à 5;Satisfaction à l’égard de la vie inférieure à 5;PT_POP_Y_GE16;Pourcentage de la population âgée de 16 ans ou plus;HSL_11;Bien-être subjectif;;;;;;;;;;12,9459175501;;;;;10,1126889899;;;8,2191791195;8,7552567824;8,0151837885;6,2811431130;
LVA;Lettonie;Satisfaction au travail;Satisfaction au travail;0_TO_10;Échelle 0-10;HSL_2;Travail et qualité de l'emploi;;;;;;;;;;7,2729157365;;;;;7,4028371892;;;;;7,6468166662;;
LVA;Lettonie;Décile supérieur des ménages les plus riches;Décile supérieur des ménages les plus riches;PT_B90_S14;Pourcentage de la richesse des ménages;HSL_1;Revenu et patrimoine;;;;;;;;;;;63,3767471313;;;52,1215858459;;;55,0798645020;;;;;
LVA;Lettonie;Cas autodéclarés de dépression;Cas autodéclarés de dépression;PT_POP_Y_GE15;Pourcentage de la population âgée de 15 ans ou plus;HSL_5;Santé;;;;;;;;;;;4,7000000000;;;;;5,6000000000;;;;;;
LVA;Lettonie;Patrimoine net médian;Patrimoine net médian;USD_HH_PPP;Dollars des É-U par ménage, PPA convertis;HSL_1;Revenu et patrimoine;;;;;;;;;;;34484,0000000000;;;48227,0000000000;;;69735,0000000000;;;;;
LVA;Lettonie;Patrimoine financier liquide équivalent insuffisant pour se maintenir au-dessus du seuil national annuel de pauvreté monétaire relative pendant trois mois;Patrimoine financier liquide équivalent insuffisant pour se maintenir au-dessus du seuil national annuel de pauvreté monétaire relative pendant trois mois;PT_POP;Pourcentage de la population;HSL_1;Revenu et patrimoine;;;;;;;;;;;79,7750115395;;;83,2275271416;;;57,4235796928;;;;;
LVA;Lettonie;Décile supérieur des résultats en compréhension de l’écrit;Décile supérieur des résultats en compréhension de l’écrit;FCTR_D1_SCR;Facteur de décile des scores les plus bas;HSL_6;Savoirs et compétences;;;;;;;;;;;;;;;1,6519769430;;;;1,6512440807;;;
LVA;Lettonie;Décile supérieur des résultats en mathématiques;Décile supérieur des résultats en mathématiques;FCTR_D1_SCR;Facteur de décile des scores les plus bas;HSL_6;Savoirs et compétences;;;;;;;;;;;;;;;1,5269019604;;;;1,5425740540;;;
LVA;Lettonie;Décile supérieur des résultats en sciences;Décile supérieur des résultats en sciences;FCTR_D1_SCR;Facteur de décile des scores les plus bas;HSL_6;Savoirs et compétences;;;;;;;;;;;;;;;1,5799745321;;;;1,5692036342;;;
LVA;Lettonie;Faible compétences dans les trois domaines évalués par le PISA;Faible compétences dans les trois domaines évalués par le PISA;PT_ST;Pourcentage de dépenses chez le même prestataire;HSL_6;Savoirs et compétences;;;;;;;;;;;;;;;9,1587040630;;;;10,6499642737;;;
LVA;Lettonie;Sentiment de solitude;Sentiment de solitude;PT_POP_Y_GE16;Pourcentage de la population âgée de 16 ans ou plus;HSL_7;Liens sociaux;;;;;;;;;;;;;;;5,9272768510;;;;6,4406868265;;;
