Cde_Pays;Pays;Cde_Mesure;Mesure;Cde_Unité;Unité;Cde_Domaine;Domaine;2004;2005;2006;2007;2008;2009;2010;2011;2012;2013;2014;2015;2016;2017;2018;2019;2020;2021;2022;2023;2024;2025
AUT;Autriche;Accessibilité financière du logement;Accessibilité financière du logement;PT_B7G_S14;Pourcentage du revenu disponible brut ajusté des ménages;HSL_3;Logement;80,5478900496;80,2863387642;80,5407381449;80,9183867474;80,7264356056;80,6919805343;80,1800346659;79,6906692922;79,8114982411;79,2066632087;79,2580931766;79,2105374973;79,3050425241;79,1502390374;79,3418907548;79,2029613777;78,7387693976;78,9233010387;79,3847865597;79,3365485262;80,3947137812;
AUT;Autriche;Espérance de vie à la naissance;Espérance de vie à la naissance;Y;Années;HSL_5;Santé;79,3000000000;79,5000000000;80,1000000000;80,3000000000;80,6000000000;80,5000000000;80,7000000000;81,1000000000;81,1000000000;81,3000000000;81,6000000000;81,3000000000;81,8000000000;81,7000000000;81,8000000000;82,0000000000;81,3000000000;81,3000000000;81,4000000000;81,9000000000;;
AUT;Autriche;Décès dus au suicide, à l’alcool ou à la drogue;Décès dus au suicide, à l’alcool ou à la drogue;DT_10P5HB;Décès pour 100 000 d'habitants;HSL_5;Santé;28,2979850922;27,8040978906;26,6944165335;27,6898711764;24,9216996680;25,1639393498;24,4961583612;24,6520850570;23,6906515130;22,3272514253;22,8449746749;22,0417622628;20,6180551600;20,2310478207;19,7573719442;18,8554621954;18,3727486609;18,1980805055;20,3222918380;20,5235034913;;
AUT;Autriche;Mortalité routière;Mortalité routière;DT_10P5HB;Décès pour 100 000 d'habitants;HSL_10;Sécurité;10,7440486200;9,3341755160;8,8285366360;8,3298304250;8,1595905350;7,5869051220;6,6001833700;6,2323909630;6,2989391090;5,3656780340;5,0313841360;5,5422501700;4,9446768490;4,7058470490;4,6264241670;4,6847268890;3,8578585480;4,0420746470;4,0920824730;4,4019178780;;
AUT;Autriche;Homicides;Homicides;DT_10P5HB;Décès pour 100 000 d'habitants;HSL_10;Sécurité;0,8000000000;0,8000000000;0,8000000000;0,6000000000;0,6000000000;0,7000000000;0,5000000000;0,5000000000;0,4000000000;0,4000000000;0,4000000000;0,6000000000;0,5000000000;0,5000000000;0,6000000000;0,5000000000;0,4000000000;0,4000000000;0,4000000000;0,6000000000;;
AUT;Autriche;Exposition à la pollution de l’air;Exposition à la pollution de l’air;PT_POP;Pourcentage de la population;HSL_9;Qualité environnementale;99,9989930000;99,9990080000;99,9990160000;99,9990230000;99,9990310000;99,9990390000;99,9990460000;99,9990540000;99,9990690000;99,9990770000;99,9990920000;99,9991000000;99,9991070000;99,9866640000;99,9867550000;99,9863360000;99,9863130000;;;;;
AUT;Autriche;Exposition à des températures extrêmes;Exposition à des températures extrêmes;PT_POP;Pourcentage de la population;HSL_9;Qualité environnementale;0,0000000000;0,0000000000;0,0000000000;0,0000000000;0,0000000000;0,0000000000;0,0000000000;0,0000000000;0,0000000000;0,0000000000;0,0000000000;1,3420495716;0,0000000000;0,0000000000;0,0000000000;0,0000000000;0,0000000000;0,0000000000;0,0000000000;0,0000000000;;
AUT;Autriche;Incapacité à maintenir le logement à bonne température;Incapacité à maintenir le logement à bonne température;PT_POP_Y_GE16;Pourcentage de la population âgée de 16 ans ou plus;HSL_3;Logement;2,3000000000;3,2000000000;3,8000000000;2,6000000000;3,9000000000;2,9000000000;3,8000000000;2,7000000000;3,2000000000;2,7000000000;3,2000000000;2,6000000000;2,7000000000;2,4000000000;1,6000000000;1,8000000000;1,5000000000;1,7000000000;2,7000000000;3,9000000000;4,0000000000;
AUT;Autriche;Difficultés à joindre les deux bouts;Difficultés à joindre les deux bouts;PT_POP_Y_GE16;Pourcentage de la population âgée de 16 ans ou plus;HSL_1;Revenu et patrimoine;10,7000000000;9,6000000000;7,8000000000;10,9000000000;14,0000000000;15,4000000000;14,4000000000;14,4000000000;14,0000000000;14,0000000000;14,9000000000;13,4000000000;12,8000000000;11,5000000000;11,3000000000;10,7000000000;9,4000000000;10,1000000000;11,9000000000;13,6000000000;13,1000000000;
AUT;Autriche;État de santé perçu comme bon;État de santé perçu comme bon;PT_POP_Y_GE16;Pourcentage de la population âgée de 16 ans ou plus;HSL_5;Santé;71,2000000000;71,7000000000;72,0000000000;72,3000000000;70,0000000000;70,0000000000;69,5000000000;68,7000000000;70,0000000000;68,6000000000;69,5000000000;69,8000000000;70,2000000000;70,3000000000;71,7000000000;71,2000000000;74,0000000000;72,2000000000;70,1000000000;69,2000000000;67,7000000000;
AUT;Autriche;État de santé perçu comme mauvais;État de santé perçu comme mauvais;PT_POP_Y_GE16;Pourcentage de la population âgée de 16 ans ou plus;HSL_5;Santé;8,6000000000;8,3000000000;7,8000000000;8,4000000000;8,9000000000;8,7000000000;9,3000000000;9,5000000000;9,0000000000;9,1000000000;8,9000000000;8,8000000000;8,1000000000;8,0000000000;8,1000000000;7,8000000000;7,5000000000;7,4000000000;8,5000000000;8,2000000000;8,4000000000;
AUT;Autriche;Salariés à temps plein dont la rémunération est inférieure à deux tiers du salaire brut médian;Salariés à temps plein dont la rémunération est inférieure à deux tiers du salaire brut médian;PT_SAL_FT;Pourcentage de salariés à plein temps;HSL_2;Travail et qualité de l'emploi;15,1530881500;15,2759616400;15,7899150600;16,1934824800;15,8655557900;16,0218085000;16,4701128000;16,0763005800;16,0727266800;15,8536380500;15,8869886900;15,8611061700;15,4306909800;15,1370649100;14,9266828200;14,7446410900;14,6743424200;14,9569576900;14,3600000000;14,2637347700;;
AUT;Autriche;Écart de rémunération entre les genres;Écart de rémunération entre les genres;PT_WG_SAL_M_D;Pourcentage du salaire des hommes dans le même décile;HSL_2;Travail et qualité de l'emploi;22,4307921600;22,0320857500;21,8551304300;21,6342763700;20,9173202700;19,3559659200;19,1888626800;18,5505541200;18,1850568400;18,0532114100;17,7288842500;17,0432529900;15,6708996400;15,3821539700;14,8766908900;14,0117408100;12,3815396700;12,1572084900;12,1436970400;11,9557102800;;
AUT;Autriche;Décile supérieur de la rémunération des salariés à temps plein;Décile supérieur de la rémunération des salariés à temps plein;FCTR_D1_EARN;Facteur de décile des gains les plus bas;HSL_2;Travail et qualité de l'emploi;3,2303632780;3,2570895850;3,3040653200;3,3660399530;3,3195849340;3,3606238790;3,3852678960;3,3434649990;3,3541482970;3,3121020800;3,3270367000;3,3183886310;3,2710530690;3,2187242550;3,1969529070;3,1706718330;3,1706559830;3,1747781200;3,1007660980;3,0578129090;;
AUT;Autriche;Jeunes sans emploi et sortis du système éducatif;Jeunes sans emploi et sortis du système éducatif;PT_POP_Y15T24;Pourcentage de la population âgée de 15 à 24 ans;HSL_2;Travail et qualité de l'emploi;10,9778640000;10,1497770000;9,8703880000;8,7249842000;8,9309807000;9,3495245000;9,6174564000;8,4380751000;8,3957586000;8,7804279000;9,7838001000;8,9864054000;9,6967039000;8,7978764000;9,2202759000;8,9372196000;10,0900000000;9,6354876000;8,9778719000;10,3207130432;10,7477693558;
AUT;Autriche;Taux de chômage de longue durée;Taux de chômage de longue durée;PT_LF;Pourcentage des dépenses de santé;HSL_2;Travail et qualité de l'emploi;1,5396965178;1,4475229961;1,4806759903;1,3413049521;1,0191233506;1,1681729816;1,2468724191;1,2161709866;1,2309270774;1,3336725501;1,5529690390;1,7012154464;1,9731612971;1,8644707320;1,4221072354;1,1440468888;1,3345461864;1,9759346218;1,2140896407;1,1559282873;1,1317312265;
AUT;Autriche;Horaires de travail lourds;Horaires de travail lourds;PT_SAL;Pourcentage de salariés;HSL_2;Travail et qualité de l'emploi;11,2400000000;11,0500000000;10,6700000000;10,8100000000;10,4900000000;9,5000000000;9,0000000000;8,7200000000;8,5300000000;7,6000000000;7,3100000000;7,1300000000;6,7700000000;6,6800000000;6,5900000000;6,1400000000;5,3300000000;4,5900000000;4,4000000000;4,3000000000;4,2400000000;
AUT;Autriche;Taux d’emploi;Taux d’emploi;PT_POP_Y25T64;Pourcentage de la population âgée de 25 à 64 ans;HSL_2;Travail et qualité de l'emploi;69,8650000000;70,8060000000;72,0900000000;73,3600000000;74,3400000000;74,0410000000;74,6460000000;74,7450000000;75,1550000000;75,2700000000;75,0270000000;75,1590000000;75,7440000000;76,4230000000;77,1780000000;77,6540000000;76,4570000000;76,4280000000;78,0060000000;77,9200000000;78,1970000000;
AUT;Autriche;Salaire brut annuel moyen;Salaire brut annuel moyen;USD_PPP;Dollars des É-U, PPA convertis;HSL_2;Travail et qualité de l'emploi;68251,9380000000;68622,2990000000;69651,6300000000;70059,1800000000;71218,0170000000;72435,3830000000;72103,7450000000;71327,6430000000;71731,8430000000;71761,7720000000;72033,9280000000;72558,7860000000;73253,7770000000;73263,1370000000;73540,1570000000;74147,7830000000;74353,0460000000;75501,7990000000;73761,4940000000;73585,5120000000;75767,1500000000;
AUT;Autriche;Revenu disponible ajusté net des ménages et des ISBLSM par habitant;Revenu disponible ajusté net des ménages et des ISBLSM par habitant;USD_PPP_PS;Dollars des É-U par personne, PPA convertis;HSL_1;Revenu et patrimoine;42817,0000000000;44034,0000000000;45186,0000000000;46205,0000000000;46668,0000000000;46927,0000000000;46352,0000000000;45582,0000000000;46342,0000000000;45159,0000000000;45131,0000000000;45022,0000000000;45586,0000000000;45694,0000000000;46107,0000000000;46162,0000000000;45404,0000000000;47035,0000000000;47446,0000000000;46782,0000000000;48500,0000000000;
AUT;Autriche;Ménages disposant d’un accès internet;Ménages disposant d’un accès internet;PT_HH;Pourcentage de ménages;HSL_3;Logement;;23,1404000000;33,1170000000;46,1463000000;54,4969000000;57,8027000000;63,7002000000;71,9837000000;77,4086000000;79,7862000000;79,3764000000;80,9113000000;85,0929000000;88,3804000000;87,6856000000;89,3345000000;89,2893000000;91,0090000000;;;;
AUT;Autriche;Tension au travail;Tension au travail;PT_SAL;Pourcentage de salariés;HSL_2;Travail et qualité de l'emploi;;30,9900608063;;;;;32,8216819763;;;;;28,5212039948;;;;;;;;;;
AUT;Autriche;Compétences des élèves en compréhension de l’écrit;Compétences des élèves en compréhension de l’écrit;PO;Points;HSL_6;Savoirs et compétences;;;490,1939773816;;;470,2836321014;;;489,6093351658;;;484,8655971403;;;484,3925684679;;;;480,4100000000;;;
AUT;Autriche;Compétences des élèves en sciences;Compétences des élèves en sciences;PO;Points;HSL_6;Savoirs et compétences;;;510,8371545182;;;494,3276731544;;;505,7812478617;;;495,0374863797;;;489,7804392268;;;;491,2700000000;;;
AUT;Autriche;Compétences des élèves en mathématiques;Compétences des élèves en mathématiques;PO;Points;HSL_6;Savoirs et compétences;;;505,4835984775;;;495,9086552519;;;505,5407430402;;;496,7422739476;;;498,9423137702;;;;487,2700000000;;;
AUT;Autriche;Participation électorale;Participation électorale;PT_VOTES;Pourcentage des votes;HSL_8;Engagement civique;;;78,4900000000;;78,8100000000;;;;;74,9100000000;;;;80,0000000000;;75,5900000000;;;;;76,2500000000;
AUT;Autriche;Bilan émotionnel négatif;Bilan émotionnel négatif;PT_POP_Y_GE15;Pourcentage de la population âgée de 15 ans ou plus;HSL_11;Bien-être subjectif;;;6,5339135407;;8,0811756718;8,0811756718;8,0811756718;8,9662575984;8,9662575984;8,9662575984;9,3190661767;9,3190661767;9,3190661767;10,0579024074;10,0579024074;10,0579024074;8,2620824073;8,2620824073;7,0230783385;7,0230783385;;
AUT;Autriche;Douleur physique;Douleur physique;PT_POP_Y_GE15;Pourcentage de la population âgée de 15 ans ou plus;HSL_11;Bien-être subjectif;;;18,0000000000;;20,0000000000;20,0000000000;20,0000000000;21,0000000000;21,0000000000;21,0000000000;19,0000000000;19,0000000000;19,0000000000;25,0000000000;25,0000000000;25,0000000000;23,6666666667;23,6666666667;23,6666666667;28,5000000000;28,5000000000;
AUT;Autriche;Sentiment d’insécurité la nuit;Sentiment d’insécurité la nuit;PT_POP_Y_GE15;Pourcentage de la population âgée de 15 ans ou plus;HSL_10;Sécurité;;;21,0000000000;;19,0000000000;19,0000000000;19,0000000000;14,3333333333;14,3333333333;14,3333333333;18,6666666667;18,6666666667;18,6666666667;15,0000000000;15,0000000000;15,0000000000;17,0000000000;17,0000000000;17,0000000000;16,0000000000;16,0000000000;
AUT;Autriche;Sentiment de sécurité la nuit;Sentiment de sécurité la nuit;PT_POP_Y_GE15;Pourcentage de la population âgée de 15 ans ou plus;HSL_10;Sécurité;;;75,0000000000;;77,3333333333;77,3333333333;77,3333333333;83,0000000000;83,0000000000;83,0000000000;80,6666666667;80,6666666667;80,6666666667;84,0000000000;84,0000000000;84,0000000000;82,3333333333;82,3333333333;82,3333333333;83,0000000000;83,0000000000;
AUT;Autriche;Soutien social;Soutien social;PT_POP_Y_GE15;Pourcentage de la population âgée de 15 ans ou plus;HSL_7;Liens sociaux;;;91,6049182182;;91,4527723010;91,4527723010;91,4527723010;93,9589030272;93,9589030272;93,9589030272;91,5153156883;91,5153156883;91,5153156883;92,1018243735;92,1018243735;92,1018243735;88,6930648755;88,6930648755;88,6930648755;89,6883561137;89,6883561137;
AUT;Autriche;Manque de soutien social;Manque de soutien social;PT_POP_Y_GE15;Pourcentage de la population âgée de 15 ans ou plus;HSL_7;Liens sociaux;;;6,2269568864;;7,8462921317;7,8462921317;7,8462921317;5,3236208192;5,3236208192;5,3236208192;8,1955118283;8,1955118283;8,1955118283;7,2085140485;7,2085140485;7,2085140485;11,1836868039;11,1836868039;11,1836868039;10,3116438863;10,3116438863;
AUT;Autriche;Quintile supérieur du revenu disponible moyen des ménages;Quintile supérieur du revenu disponible moyen des ménages;FCTR_Q1_INC;Facteur de quintile des revenus les plus bas;HSL_1;Revenu et patrimoine;;;;4,3652549494;4,2636827641;4,5012318678;4,2599630326;4,3497212913;4,2580454441;4,2406072022;4,1298290224;4,1640321699;4,4503342488;4,2024199115;4,2967993011;4,2191432142;4,1842366292;4,3658104628;4,4191025752;;;
AUT;Autriche;Revenu disponible des ménages inférieur au seuil de pauvreté monétaire relative;Revenu disponible des ménages inférieur au seuil de pauvreté monétaire relative;PT_POP;Pourcentage de la population;HSL_1;Revenu et patrimoine;;;;9,6573853061;9,3020485346;9,5531957339;8,8743274923;9,1321940607;9,5969410879;9,0160337648;9,1170627035;8,6702414075;9,7758351301;9,4318019122;9,3817650858;9,9864744610;9,5985894171;9,8272658495;9,5531730213;;;
AUT;Autriche;Insécurité sur le marché du travail;Insécurité sur le marché du travail;PT_EARN_PRVS_LST;Pourcentage des gains antérieurs perdus;HSL_2;Travail et qualité de l'emploi;;;;1,4546896219;1,4040522575;1,8467334509;1,5119911432;1,4946224689;1,7328391075;1,8900364637;1,9504467249;2,0555036068;2,2957873344;;;;;;;;;
AUT;Autriche;Écart entre les genres en termes de temps de travail;Écart entre les genres en termes de temps de travail;MN_D;Minutes par jour;HSL_4;Equilibre travail-vie;;;;;13,5818923752;;;;;;;;;;;;;;3,5442086530;;;
AUT;Autriche;Temps libre;Temps libre;H_D;Heures par jour;HSL_4;Equilibre travail-vie;;;;;;14,5062930000;;;;;;;;;;;;;15,5196800000;;;
AUT;Autriche;Longues heures de travail non rémunéré;Longues heures de travail non rémunéré;PT_POP_Y15T64;Pourcentage de la population âgée de 15 à 64 ans;HSL_4;Equilibre travail-vie;;;;;;15,2649400000;;;;;;;;;;;;;10,8275200000;;;
AUT;Autriche;Temps consacré aux interactions sociales;Temps consacré aux interactions sociales;H_WK;Heures par semaine;HSL_7;Liens sociaux;;;;;;9,4723095000;;;;;;;;;;;;;7,1256850000;;;
AUT;Autriche;Ménages vivant dans des logements surpeuplés;Ménages vivant dans des logements surpeuplés;PT_HH;Pourcentage de ménages;HSL_3;Logement;;;;;;;10,2343186736;10,7126556337;11,5940339863;11,9282573462;12,6881659031;11,3668158650;11,3846279681;12,2610963881;10,8559958637;12,3769402504;10,6852144003;10,7429914176;11,6731904447;11,1476913095;10,7105404139;
AUT;Autriche;Surcharge financière liée au coût du logement;Surcharge financière liée au coût du logement;PT_POP;Pourcentage de la population;HSL_3;Logement;;;;;;;11,2188898027;8,3098798990;12,3705454171;12,9859775305;11,5292139351;10,6463357806;12,5114426017;11,0916763544;11,7060184479;12,3502723873;9,8462030292;11,5269094706;12,4123372138;;;
AUT;Autriche;Décile supérieur des ménages les plus riches;Décile supérieur des ménages les plus riches;PT_B90_S14;Pourcentage de la richesse des ménages;HSL_1;Revenu et patrimoine;;;;;;;;61,7056617737;;;55,5905456543;;;56,4958877563;;;;51,5127601624;;;;
AUT;Autriche;Patrimoine net médian;Patrimoine net médian;USD_HH_PPP;Dollars des É-U par ménage, PPA convertis;HSL_1;Revenu et patrimoine;;;;;;;;134748,0000000000;;;142579,0000000000;;;132043,0000000000;;;;189148,0000000000;;;;
AUT;Autriche;Patrimoine financier liquide équivalent insuffisant pour se maintenir au-dessus du seuil national annuel de pauvreté monétaire relative pendant trois mois;Patrimoine financier liquide équivalent insuffisant pour se maintenir au-dessus du seuil national annuel de pauvreté monétaire relative pendant trois mois;PT_POP;Pourcentage de la population;HSL_1;Revenu et patrimoine;;;;;;;;25,4272818565;;;24,1589576006;;;24,8837068677;;;;23,7985759974;;;;
AUT;Autriche;Décile supérieur des résultats des adultes en calcul;Décile supérieur des résultats des adultes en calcul;FCTR_D1_SCR;Facteur de décile des scores les plus bas;HSL_6;Savoirs et compétences;;;;;;;;;1,5694782734;;;;;;;;;;;;;
AUT;Autriche;Décile supérieur des résultats des adultes en lecture et écriture;Décile supérieur des résultats des adultes en lecture et écriture;FCTR_D1_SCR;Facteur de décile des scores les plus bas;HSL_6;Savoirs et compétences;;;;;;;;;1,5178591013;;;;;;;;;;;;;
AUT;Autriche;Adultes ayant de faibles compétences en calcul;Adultes ayant de faibles compétences en calcul;PT_ST;Pourcentage de dépenses chez le même prestataire;HSL_6;Savoirs et compétences;;;;;;;;;10,4620340000;;;;;;;;;;;19,8015893425;;
AUT;Autriche;Compétences des adultes en calcul;Compétences des adultes en calcul;PO;Points;HSL_6;Savoirs et compétences;;;;;;;;;275,0440426000;;;;;;;;;;;270,2898809000;;
AUT;Autriche;Compétences des adultes en lecture et écriture;Compétences des adultes en lecture et écriture;PO;Points;HSL_6;Savoirs et compétences;;;;;;;;;269,4511534000;;;;;;;;;;;257,5392100000;;
AUT;Autriche;Accès à des espaces verts;Accès à des espaces verts;PT_POP_URB;Pourcentage de population urbaine;HSL_9;Qualité environnementale;;;;;;;;;77,4468416809;;;;;;77,2525274755;;;;;;;
AUT;Autriche;Quintile supérieur de la satisfaction à l’égard de la vie;Quintile supérieur de la satisfaction à l’égard de la vie;FCTR_Q1_SCR_LIFE_SATISFACTION;Facteur de quintile de satisfaction à l'égard de la vie les plus bas;HSL_11;Bien-être subjectif;;;;;;;;;;2,0021492445;;;;;1,7828069456;;;1,8127149846;1,8199906718;1,9696634908;2,0317766315;
AUT;Autriche;Quintile supérieur de la satisfaction à l’égard des relations personnelles;Quintile supérieur de la satisfaction à l’égard des relations personnelles;FCTR_Q1_SCR_PERS_REL_SATISFACTION;Facteur de quintile de satisfaction des relations personnelle les plus bas;HSL_7;Liens sociaux;;;;;;;;;;1,7695630113;;;;;1,6250064969;;;;1,6171412595;;;
AUT;Autriche;Quintile supérieur de la satisfaction à l’égard de l’emploi du temps;Quintile supérieur de la satisfaction à l’égard de l’emploi du temps;FCTR_Q1_SCR_TIME_USE;Facteur de quintile de satisfaction à l'égard de l'utilisation du temps les plus bas;HSL_4;Equilibre travail-vie;;;;;;;;;;2,7797688054;;;;;2,6287195456;;;;2,4552846812;;;
AUT;Autriche;Satisfaction à l’égard de la vie;Satisfaction à l’égard de la vie;0_TO_10;Échelle 0-10;HSL_11;Bien-être subjectif;;;;;;;;;;7,8100056064;;;;;8,0024162941;;;7,9919458767;7,8826444055;7,6961474970;7,6220193507;
AUT;Autriche;Satisfaction à l’égard de l’emploi du temps;Satisfaction à l’égard de l’emploi du temps;0_TO_10;Échelle 0-10;HSL_4;Equilibre travail-vie;;;;;;;;;;7,2657021363;;;;;7,2978260699;;;;7,4115894970;;;
AUT;Autriche;Satisfaction à l’égard des relations personnelles;Satisfaction à l’égard des relations personnelles;0_TO_10;Échelle 0-10;HSL_7;Liens sociaux;;;;;;;;;;8,4886009036;;;;;8,5834914586;;;;8,5634548772;;;
AUT;Autriche;Satisfaction à l’égard des relations personnelles inférieure à 5;Satisfaction à l’égard des relations personnelles inférieure à 5;PT_POP_Y_GE16;Pourcentage de la population âgée de 16 ans ou plus;HSL_7;Liens sociaux;;;;;;;;;;3,4196255336;;;;;2,4059352379;;;;2,4961818133;;;
AUT;Autriche;Satisfaction à l’égard de l’emploi du temps inférieure à 5;Satisfaction à l’égard de l’emploi du temps inférieure à 5;PT_POP_Y_GE16;Pourcentage de la population âgée de 16 ans ou plus;HSL_4;Equilibre travail-vie;;;;;;;;;;12,7480264143;;;;;11,4960802338;;;;9,9971327405;;;
AUT;Autriche;Satisfaction à l’égard de la vie inférieure à 5;Satisfaction à l’égard de la vie inférieure à 5;PT_POP_Y_GE16;Pourcentage de la population âgée de 16 ans ou plus;HSL_11;Bien-être subjectif;;;;;;;;;;4,5524043578;;;;;2,8334172260;;;3,4628631811;3,4231842115;4,8735314097;5,2003849213;
AUT;Autriche;Satisfaction au travail;Satisfaction au travail;0_TO_10;Échelle 0-10;HSL_2;Travail et qualité de l'emploi;;;;;;;;;;7,9745460996;;;;;7,9606734155;;;;;7,7133880418;;
AUT;Autriche;Cas autodéclarés de dépression;Cas autodéclarés de dépression;PT_POP_Y_GE15;Pourcentage de la population âgée de 15 ans ou plus;HSL_5;Santé;;;;;;;;;;;5,0000000000;;;;;5,6000000000;;;;;;
AUT;Autriche;Décile supérieur des résultats en compréhension de l’écrit;Décile supérieur des résultats en compréhension de l’écrit;FCTR_D1_SCR;Facteur de décile des scores les plus bas;HSL_6;Savoirs et compétences;;;;;;;;;;;;;;;1,7494916916;;;;1,8053552532;;;
AUT;Autriche;Décile supérieur des résultats en mathématiques;Décile supérieur des résultats en mathématiques;FCTR_D1_SCR;Facteur de décile des scores les plus bas;HSL_6;Savoirs et compétences;;;;;;;;;;;;;;;1,6531181335;;;;1,6795388847;;;
AUT;Autriche;Décile supérieur des résultats en sciences;Décile supérieur des résultats en sciences;FCTR_D1_SCR;Facteur de décile des scores les plus bas;HSL_6;Savoirs et compétences;;;;;;;;;;;;;;;1,6987230778;;;;1,7480550170;;;
AUT;Autriche;Faible compétences dans les trois domaines évalués par le PISA;Faible compétences dans les trois domaines évalués par le PISA;PT_ST;Pourcentage de dépenses chez le même prestataire;HSL_6;Savoirs et compétences;;;;;;;;;;;;;;;13,5120534072;;;;15,5322921324;;;
AUT;Autriche;Sentiment de solitude;Sentiment de solitude;PT_POP_Y_GE16;Pourcentage de la population âgée de 16 ans ou plus;HSL_7;Liens sociaux;;;;;;;;;;;;;;;3,4708502358;;;;4,2547728909;;;
AUT;Autriche;Avoir son mot à dire concernant l’action des pouvoirs publics;Avoir son mot à dire concernant l’action des pouvoirs publics;PT_POP_Y16T65;Pourcentage de la population âgée de 16 à 65 ans;HSL_8;Engagement civique;;;;;;;;;;;;;;;;;;18,0924540000;;;;
AUT;Autriche;Ne pas avoir son mot à dire concernant l’action des pouvoirs publics;Ne pas avoir son mot à dire concernant l’action des pouvoirs publics;PT_POP_Y16T65;Pourcentage de la population âgée de 16 à 65 ans;HSL_8;Engagement civique;;;;;;;;;;;;;;;;;;63,9998940000;;;;
BEL;Belgique;Accessibilité financière du logement;Accessibilité financière du logement;PT_B7G_S14;Pourcentage du revenu disponible brut ajusté des ménages;HSL_3;Logement;81,7497970671;81,5541419204;81,5416206117;81,9028541332;81,4789201093;81,3574050152;80,1496001068;79,7568918754;79,3608437988;79,3476319554;79,8882666752;79,8464339998;79,9362732432;79,9509800914;80,0845608292;80,4111912624;80,6831223978;80,3713361305;79,3954351841;80,8688834733;81,1270599716;
BEL;Belgique;Espérance de vie à la naissance;Espérance de vie à la naissance;Y;Années;HSL_5;Santé;79,0000000000;79,1000000000;79,5000000000;79,9000000000;79,8000000000;80,2000000000;80,3000000000;80,7000000000;80,5000000000;80,7000000000;81,4000000000;81,1000000000;81,5000000000;81,6000000000;81,7000000000;82,1000000000;80,8000000000;81,9000000000;81,8000000000;82,5000000000;;
BEL;Belgique;Décès dus au suicide, à l’alcool ou à la drogue;Décès dus au suicide, à l’alcool ou à la drogue;DT_10P5HB;Décès pour 100 000 d'habitants;HSL_5;Santé;22,9376487611;23,2744323011;22,4649818343;22,1579148160;23,4790460402;23,5310940335;22,5036161123;23,2301789755;23,4444400110;21,4524873021;21,7760758015;21,3793137676;21,9819814341;20,2658830595;23,1790652311;21,8672714094;22,0183154875;21,7059628824;;;;
BEL;Belgique;Mortalité routière;Mortalité routière;DT_10P5HB;Décès pour 100 000 d'habitants;HSL_10;Sécurité;11,1600106600;10,7934090900;10,4854418300;10,2957922800;9,1503498650;8,8547271790;7,8013243160;8,0085056850;7,4458005140;6,8462419190;6,6464110230;6,7587968140;5,9127618760;5,3537717890;5,2857018090;5,6053714080;4,3246132720;4,4535760010;4,6209874640;4,2376494090;;
BEL;Belgique;Homicides;Homicides;DT_10P5HB;Décès pour 100 000 d'habitants;HSL_10;Sécurité;1,7000000000;1,5000000000;1,4000000000;1,5000000000;1,2000000000;1,2000000000;1,1000000000;1,3000000000;1,2000000000;1,0000000000;1,0000000000;1,1000000000;1,1000000000;1,0000000000;1,0000000000;0,8000000000;0,7000000000;0,7000000000;;;;
BEL;Belgique;Exposition à la pollution de l’air;Exposition à la pollution de l’air;PT_POP;Pourcentage de la population;HSL_9;Qualité environnementale;99,9633870000;99,9634250000;99,9633480000;99,9632800000;99,9632030000;99,9631350000;99,9630580000;99,9629750000;99,9628830000;99,9627990000;99,9627150000;99,9626310000;99,9626080000;99,9625930000;99,9625780000;99,9625630000;99,9625470000;;;;;
