ESP;Espagne;Sentiment d’insécurité la nuit;Sentiment d’insécurité la nuit;PT_POP_Y_GE15;Pourcentage de la population âgée de 15 ans ou plus;HSL_10;Sécurité;;;29,5000000000;29,5000000000;31,0000000000;31,0000000000;31,0000000000;24,0000000000;24,0000000000;24,0000000000;16,3333333333;16,3333333333;16,3333333333;18,0000000000;18,0000000000;18,0000000000;19,0000000000;19,0000000000;19,0000000000;18,0000000000;18,0000000000;
ESP;Espagne;Sentiment de sécurité la nuit;Sentiment de sécurité la nuit;PT_POP_Y_GE15;Pourcentage de la population âgée de 15 ans ou plus;HSL_10;Sécurité;;;64,5000000000;64,5000000000;65,3333333333;65,3333333333;65,3333333333;73,6666666667;73,6666666667;73,6666666667;83,3333333333;83,3333333333;83,3333333333;81,3333333333;81,3333333333;81,3333333333;80,3333333333;80,3333333333;80,3333333333;81,5000000000;81,5000000000;
ESP;Espagne;Soutien social;Soutien social;PT_POP_Y_GE15;Pourcentage de la population âgée de 15 ans ou plus;HSL_7;Liens sociaux;;;95,1787272546;95,1787272546;93,2760440053;93,2760440053;93,2760440053;93,1177734682;93,1177734682;93,1177734682;94,7827313344;94,7827313344;94,7827313344;91,6868047278;91,6868047278;91,6868047278;93,1459859007;93,1459859007;93,1459859007;92,1724430822;92,1724430822;
ESP;Espagne;Manque de soutien social;Manque de soutien social;PT_POP_Y_GE15;Pourcentage de la population âgée de 15 ans ou plus;HSL_7;Liens sociaux;;;4,0741075411;4,0741075411;5,6853359477;5,6853359477;5,6853359477;6,2906863262;6,2906863262;6,2906863262;5,1265282466;5,1265282466;5,1265282466;7,8844220971;7,8844220971;7,8844220971;6,8226476994;6,8226476994;6,8226476994;7,7666497002;7,7666497002;
ESP;Espagne;Salariés à temps plein dont la rémunération est inférieure à deux tiers du salaire brut médian;Salariés à temps plein dont la rémunération est inférieure à deux tiers du salaire brut médian;PT_SAL_FT;Pourcentage de salariés à plein temps;HSL_2;Travail et qualité de l'emploi;;;10,1111111100;;;;10,6111111100;;;;9,9666666670;;;;10,8253968300;;;;10,3596871900;8,8568394480;;
ESP;Espagne;Écart de rémunération entre les genres;Écart de rémunération entre les genres;PT_WG_SAL_M_D;Pourcentage du salaire des hommes dans le même décile;HSL_2;Travail et qualité de l'emploi;;;13,5333333300;;;;13,5044642900;;;;11,5404976200;;;;8,6216072380;;;;5,7073170730;6,2009459510;;
ESP;Espagne;Décile supérieur de la rémunération des salariés à temps plein;Décile supérieur de la rémunération des salariés à temps plein;FCTR_D1_EARN;Facteur de décile des gains les plus bas;HSL_2;Travail et qualité de l'emploi;;;3,0981461290;;;;3,0987654320;;;;3,1241007190;;;;3,1693404640;3,7004015240;2,5201917390;3,6364139460;3,0911214950;2,4964886990;;
ESP;Espagne;Quintile supérieur du revenu disponible moyen des ménages;Quintile supérieur du revenu disponible moyen des ménages;FCTR_Q1_INC;Facteur de quintile des revenus les plus bas;HSL_1;Revenu et patrimoine;;;;5,3596393173;5,7339276078;6,0318514755;6,0936128514;6,3298303727;6,0823282403;6,6250466438;6,5979650937;6,5000769867;6,4843696875;5,9841947269;5,9360709874;5,7232719512;6,1048669514;5,6166542032;5,4902842323;;;
ESP;Espagne;Revenu disponible des ménages inférieur au seuil de pauvreté monétaire relative;Revenu disponible des ménages inférieur au seuil de pauvreté monétaire relative;PT_POP;Pourcentage de la population;HSL_1;Revenu et patrimoine;;;;14,3880454148;14,5855929796;14,8215367956;13,8992449104;14,6659394736;14,0550018423;15,9010265906;15,2583925589;15,3129834003;15,5591882789;14,7935300329;14,1514480477;14,6633648690;15,3828847514;14,4330355248;13,7475355870;;;
ESP;Espagne;Insécurité sur le marché du travail;Insécurité sur le marché du travail;PT_EARN_PRVS_LST;Pourcentage des gains antérieurs perdus;HSL_2;Travail et qualité de l'emploi;;;;4,1595554352;7,7861213684;9,7288837433;10,6982851028;12,9118080139;16,0195293427;18,1161499023;17,3072853088;18,5261287689;15,8075180054;;;;;;;;;
ESP;Espagne;Temps consacré aux interactions sociales;Temps consacré aux interactions sociales;H_WK;Heures par semaine;HSL_7;Liens sociaux;;;;;;5,8043662000;;;;;;;;;;;;;;;;
ESP;Espagne;Temps libre;Temps libre;H_D;Heures par jour;HSL_4;Equilibre travail-vie;;;;;;15,7485930000;;;;;;;;;;;;;;;;
ESP;Espagne;Longues heures de travail non rémunéré;Longues heures de travail non rémunéré;PT_POP_Y15T64;Pourcentage de la population âgée de 15 à 64 ans;HSL_4;Equilibre travail-vie;;;;;;14,6133500000;;;;;;;;;;;;;;;;
ESP;Espagne;Écart entre les genres en termes de temps de travail;Écart entre les genres en termes de temps de travail;MN_D;Minutes par jour;HSL_4;Equilibre travail-vie;;;;;;77,2888428000;;;;;;;;;;;;;;;;
ESP;Espagne;Surcharge financière liée au coût du logement;Surcharge financière liée au coût du logement;PT_POP;Pourcentage de la population;HSL_3;Logement;;;;;;;30,7597845793;32,5679928064;33,4845811129;28,8825273514;32,7262878418;30,1263749599;27,6480585337;29,2939692736;24,1138353944;24,4355618954;21,3363647461;26,2570351362;24,1070747375;;;
ESP;Espagne;Ménages vivant dans des logements surpeuplés;Ménages vivant dans des logements surpeuplés;PT_HH;Pourcentage de ménages;HSL_3;Logement;;;;;;;3,1087566167;3,7253394723;2,9025116935;3,0729712918;2,9470205307;2,8797160834;3,0432183295;2,8424452990;2,6725178584;3,0136941001;3,7022013217;3,4399945289;3,7988688797;4,3451957405;5,0703074783;
ESP;Espagne;Décile supérieur des résultats des adultes en calcul;Décile supérieur des résultats des adultes en calcul;FCTR_D1_SCR;Facteur de décile des scores les plus bas;HSL_6;Savoirs et compétences;;;;;;;;;1,7291243076;;;;;;;;;;;;;
ESP;Espagne;Décile supérieur des résultats des adultes en lecture et écriture;Décile supérieur des résultats des adultes en lecture et écriture;FCTR_D1_SCR;Facteur de décile des scores les plus bas;HSL_6;Savoirs et compétences;;;;;;;;;1,6591920853;;;;;;;;;;;;;
ESP;Espagne;Adultes ayant de faibles compétences en calcul;Adultes ayant de faibles compétences en calcul;PT_ST;Pourcentage de dépenses chez le même prestataire;HSL_6;Savoirs et compétences;;;;;;;;;22,4710820000;;;;;;;;;;;24,1039932060;;
ESP;Espagne;Compétences des adultes en calcul;Compétences des adultes en calcul;PO;Points;HSL_6;Savoirs et compétences;;;;;;;;;245,8217334000;;;;;;;;;;;251,7211580000;;
ESP;Espagne;Compétences des adultes en lecture et écriture;Compétences des adultes en lecture et écriture;PO;Points;HSL_6;Savoirs et compétences;;;;;;;;;251,7898349000;;;;;;;;;;;248,9407031000;;
ESP;Espagne;Décile supérieur des ménages les plus riches;Décile supérieur des ménages les plus riches;PT_B90_S14;Pourcentage de la richesse des ménages;HSL_1;Revenu et patrimoine;;;;;;;;;45,5776290894;;51,8583946228;;;;52,6682624817;;;53,2204513550;;;;
ESP;Espagne;Accès à des espaces verts;Accès à des espaces verts;PT_POP_URB;Pourcentage de population urbaine;HSL_9;Qualité environnementale;;;;;;;;;72,3320997962;;;;;;73,4068352014;;;;;;;
ESP;Espagne;Patrimoine net médian;Patrimoine net médian;USD_HH_PPP;Dollars des É-U par ménage, PPA convertis;HSL_1;Revenu et patrimoine;;;;;;;;;295647,0000000000;;223671,0000000000;;;;212820,0000000000;;;219234,0000000000;;;;
ESP;Espagne;Patrimoine financier liquide équivalent insuffisant pour se maintenir au-dessus du seuil national annuel de pauvreté monétaire relative pendant trois mois;Patrimoine financier liquide équivalent insuffisant pour se maintenir au-dessus du seuil national annuel de pauvreté monétaire relative pendant trois mois;PT_POP;Pourcentage de la population;HSL_1;Revenu et patrimoine;;;;;;;;;40,9907072783;;42,8327739239;;;;38,9619827271;;;36,7403239012;;;;
ESP;Espagne;Quintile supérieur de la satisfaction à l’égard de la vie;Quintile supérieur de la satisfaction à l’égard de la vie;FCTR_Q1_SCR_LIFE_SATISFACTION;Facteur de quintile de satisfaction à l'égard de la vie les plus bas;HSL_11;Bien-être subjectif;;;;;;;;;;2,3842936684;;;;;2,1069322600;;;2,2649103211;2,2330525387;2,1480090446;2,1950054821;
ESP;Espagne;Quintile supérieur de la satisfaction à l’égard des relations personnelles;Quintile supérieur de la satisfaction à l’égard des relations personnelles;FCTR_Q1_SCR_PERS_REL_SATISFACTION;Facteur de quintile de satisfaction des relations personnelle les plus bas;HSL_7;Liens sociaux;;;;;;;;;;1,8803795942;;;;;1,6837547632;;;;1,8589665233;;;
ESP;Espagne;Quintile supérieur de la satisfaction à l’égard de l’emploi du temps;Quintile supérieur de la satisfaction à l’égard de l’emploi du temps;FCTR_Q1_SCR_TIME_USE;Facteur de quintile de satisfaction à l'égard de l'utilisation du temps les plus bas;HSL_4;Equilibre travail-vie;;;;;;;;;;3,0781081946;;;;;2,7592670711;;;;3,1351457308;;;
ESP;Espagne;Satisfaction à l’égard de la vie;Satisfaction à l’égard de la vie;0_TO_10;Échelle 0-10;HSL_11;Bien-être subjectif;;;;;;;;;;6,8805823872;;;;;7,3293713044;;;7,1921043699;7,1268416488;7,2269001128;7,1825148781;
ESP;Espagne;Satisfaction à l’égard de l’emploi du temps;Satisfaction à l’égard de l’emploi du temps;0_TO_10;Échelle 0-10;HSL_4;Equilibre travail-vie;;;;;;;;;;6,6147058005;;;;;6,8498860331;;;;6,5759127837;;;
ESP;Espagne;Satisfaction à l’égard des relations personnelles;Satisfaction à l’égard des relations personnelles;0_TO_10;Échelle 0-10;HSL_7;Liens sociaux;;;;;;;;;;7,8062646597;;;;;8,2491528446;;;;7,8686015180;;;
ESP;Espagne;Satisfaction à l’égard des relations personnelles inférieure à 5;Satisfaction à l’égard des relations personnelles inférieure à 5;PT_POP_Y_GE16;Pourcentage de la population âgée de 16 ans ou plus;HSL_7;Liens sociaux;;;;;;;;;;3,5195823988;;;;;1,9282066310;;;;3,2106351183;;;
ESP;Espagne;Satisfaction à l’égard de l’emploi du temps inférieure à 5;Satisfaction à l’égard de l’emploi du temps inférieure à 5;PT_POP_Y_GE16;Pourcentage de la population âgée de 16 ans ou plus;HSL_4;Equilibre travail-vie;;;;;;;;;;16,1264833090;;;;;13,1855106964;;;;16,6436073875;;;
ESP;Espagne;Satisfaction à l’égard de la vie inférieure à 5;Satisfaction à l’égard de la vie inférieure à 5;PT_POP_Y_GE16;Pourcentage de la population âgée de 16 ans ou plus;HSL_11;Bien-être subjectif;;;;;;;;;;9,7423612861;;;;;6,1237758007;;;7,4551460076;7,7713513072;6,8636367718;6,9892021145;
ESP;Espagne;Satisfaction au travail;Satisfaction au travail;0_TO_10;Échelle 0-10;HSL_2;Travail et qualité de l'emploi;;;;;;;;;;6,9059591420;;;;;7,3329497036;;;;;7,2530427124;;
ESP;Espagne;Cas autodéclarés de dépression;Cas autodéclarés de dépression;PT_POP_Y_GE15;Pourcentage de la population âgée de 15 ans ou plus;HSL_5;Santé;;;;;;;;;;;6,7000000000;;;;;4,8000000000;;;;;;
ESP;Espagne;Décile supérieur des résultats en mathématiques;Décile supérieur des résultats en mathématiques;FCTR_D1_SCR;Facteur de décile des scores les plus bas;HSL_6;Savoirs et compétences;;;;;;;;;;;;;;;1,6262840033;;;;1,6275704593;;;
ESP;Espagne;Décile supérieur des résultats en sciences;Décile supérieur des résultats en sciences;FCTR_D1_SCR;Facteur de décile des scores les plus bas;HSL_6;Savoirs et compétences;;;;;;;;;;;;;;;1,6390125751;;;;1,6547201544;;;
ESP;Espagne;Sentiment de solitude;Sentiment de solitude;PT_POP_Y_GE16;Pourcentage de la population âgée de 16 ans ou plus;HSL_7;Liens sociaux;;;;;;;;;;;;;;;4,5251576063;;;;5,4010666884;;;
ESP;Espagne;Décile supérieur des résultats en compréhension de l’écrit;Décile supérieur des résultats en compréhension de l’écrit;FCTR_D1_SCR;Facteur de décile des scores les plus bas;HSL_6;Savoirs et compétences;;;;;;;;;;;;;;;;;;;1,7231081473;;;
ESP;Espagne;Faible compétences dans les trois domaines évalués par le PISA;Faible compétences dans les trois domaines évalués par le PISA;PT_ST;Pourcentage de dépenses chez le même prestataire;HSL_6;Savoirs et compétences;;;;;;;;;;;;;;;;;;;12,8751894531;;;
ESP;Espagne;Avoir son mot à dire concernant l’action des pouvoirs publics;Avoir son mot à dire concernant l’action des pouvoirs publics;PT_POP_Y16T65;Pourcentage de la population âgée de 16 à 65 ans;HSL_8;Engagement civique;;;;;;;;;;;;;;;;;;;;30,9808530000;;
ESP;Espagne;Ne pas avoir son mot à dire concernant l’action des pouvoirs publics;Ne pas avoir son mot à dire concernant l’action des pouvoirs publics;PT_POP_Y16T65;Pourcentage de la population âgée de 16 à 65 ans;HSL_8;Engagement civique;;;;;;;;;;;;;;;;;;;;48,3831720000;;
EST;Estonie;Accessibilité financière du logement;Accessibilité financière du logement;PT_B7G_S14;Pourcentage du revenu disponible brut ajusté des ménages;HSL_3;Logement;77,2312966656;78,5670104576;78,9673472842;79,0751481070;81,6620792631;81,6425403895;80,6746560142;80,9848595670;79,2381270844;79,4348850723;79,3235679964;79,6691216486;79,5785255303;79,6995865457;80,5886247161;80,3555593543;80,9052901558;80,1509004268;76,8471483665;76,6440155278;;
EST;Estonie;Espérance de vie à la naissance;Espérance de vie à la naissance;Y;Années;HSL_5;Santé;72,4000000000;73,0000000000;73,2000000000;73,2000000000;74,4000000000;75,3000000000;76,0000000000;76,6000000000;76,7000000000;77,5000000000;77,4000000000;78,0000000000;78,0000000000;78,4000000000;78,5000000000;79,0000000000;78,9000000000;77,2000000000;78,1000000000;79,1000000000;;
EST;Estonie;Décès dus au suicide, à l’alcool ou à la drogue;Décès dus au suicide, à l’alcool ou à la drogue;DT_10P5HB;Décès pour 100 000 d'habitants;HSL_5;Santé;70,1076501538;65,6994541513;62,3051284442;70,1009415902;62,7369279729;44,2616103212;38,1179071402;38,4862749937;43,4391963427;50,6643199075;37,6136716920;50,8482969030;50,3172873134;36,0381898713;28,7143456990;27,1112398333;28,5680634378;29,0882064986;42,3158574624;;;
EST;Estonie;Mortalité routière;Mortalité routière;DT_10P5HB;Décès pour 100 000 d'habitants;HSL_10;Sécurité;12,4766063600;12,5482091100;15,1469026800;14,6194468500;9,8721851180;7,4933590110;5,9332694940;7,6086358770;6,5774750960;6,1456892540;5,9336120100;5,0934805730;5,3959978420;3,6435845580;5,0681668440;3,9189146420;4,5129001250;4,1324425290;3,7068888820;4,3185857290;;
EST;Estonie;Homicides;Homicides;DT_10P5HB;Décès pour 100 000 d'habitants;HSL_10;Sécurité;8,0000000000;9,1000000000;7,3000000000;7,0000000000;6,6000000000;6,0000000000;4,6000000000;4,8000000000;4,9000000000;3,9000000000;3,1000000000;3,1000000000;2,4000000000;2,3000000000;2,1000000000;1,9000000000;3,1000000000;1,9000000000;1,4000000000;;;
EST;Estonie;Exposition à la pollution de l’air;Exposition à la pollution de l’air;PT_POP;Pourcentage de la population;HSL_9;Qualité environnementale;99,9410100000;99,9406590000;99,9404600000;99,9214550000;99,9110410000;99,9216000000;99,9396510000;99,9223560000;99,8924480000;99,8985440000;99,9266890000;99,3513490000;98,4408720000;89,0398250000;99,8147200000;97,9237900000;89,1276320000;;;;;
EST;Estonie;Exposition à des températures extrêmes;Exposition à des températures extrêmes;PT_POP;Pourcentage de la population;HSL_9;Qualité environnementale;0,0000000000;0,0000000000;0,0000000000;0,0000000000;0,0000000000;0,0000000000;0,0000000000;0,0000000000;0,0000000000;0,0000000000;0,0000000000;0,0000000000;0,0000000000;0,0000000000;0,0000000000;0,0000000000;0,0000000000;0,0000000000;0,0000000000;0,0000000000;;
EST;Estonie;Incapacité à maintenir le logement à bonne température;Incapacité à maintenir le logement à bonne température;PT_POP_Y_GE16;Pourcentage de la population âgée de 16 ans ou plus;HSL_3;Logement;5,8000000000;2,6000000000;2,3000000000;3,6000000000;1,1000000000;1,7000000000;3,1000000000;3,0000000000;4,2000000000;2,9000000000;1,7000000000;2,0000000000;2,7000000000;2,9000000000;2,3000000000;2,5000000000;2,7000000000;2,0000000000;3,4000000000;4,1000000000;3,6000000000;
EST;Estonie;Difficultés à joindre les deux bouts;Difficultés à joindre les deux bouts;PT_POP_Y_GE16;Pourcentage de la population âgée de 16 ans ou plus;HSL_1;Revenu et patrimoine;15,3000000000;12,3000000000;15,4000000000;11,0000000000;11,2000000000;20,5000000000;25,5000000000;24,3000000000;24,1000000000;23,4000000000;19,7000000000;16,2000000000;15,4000000000;14,3000000000;13,9000000000;11,2000000000;9,1000000000;7,8000000000;9,5000000000;11,6000000000;9,9000000000;
EST;Estonie;État de santé perçu comme bon;État de santé perçu comme bon;PT_POP_Y_GE16;Pourcentage de la population âgée de 16 ans ou plus;HSL_5;Santé;49,8000000000;53,8000000000;53,2000000000;53,3000000000;54,5000000000;51,5000000000;52,7000000000;51,8000000000;52,4000000000;53,4000000000;51,8000000000;51,4000000000;52,8000000000;52,5000000000;51,6000000000;56,5000000000;58,4000000000;58,2000000000;57,7000000000;56,2000000000;57,7000000000;
EST;Estonie;État de santé perçu comme mauvais;État de santé perçu comme mauvais;PT_POP_Y_GE16;Pourcentage de la population âgée de 16 ans ou plus;HSL_5;Santé;15,2000000000;16,3000000000;15,1000000000;14,8000000000;14,8000000000;14,1000000000;14,9000000000;16,3000000000;16,3000000000;15,6000000000;16,5000000000;15,7000000000;14,4000000000;14,6000000000;14,7000000000;13,3000000000;11,4000000000;12,1000000000;13,0000000000;13,4000000000;12,3000000000;
EST;Estonie;Jeunes sans emploi et sortis du système éducatif;Jeunes sans emploi et sortis du système éducatif;PT_POP_Y15T24;Pourcentage de la population âgée de 15 à 24 ans;HSL_2;Travail et qualité de l'emploi;13,2892250000;10,5469120000;9,4574041000;10,5161760000;7,8717885000;14,3319030000;15,3784510000;11,8993640000;12,8923880000;11,8322730000;12,3152560000;10,8813870000;9,6078501000;9,8049841000;10,6708610000;7,2130351000;8,8554201000;11,6084790000;11,6706450000;11,1286120000;9,5577840805;
EST;Estonie;Taux de chômage de longue durée;Taux de chômage de longue durée;PT_LF;Pourcentage des dépenses de santé;HSL_2;Travail et qualité de l'emploi;5,2960320299;4,4555486685;2,9435939750;2,3544869906;1,7322664916;3,7739779738;7,7248124155;7,2035347976;5,5693271814;3,9233569421;3,3974585207;2,4027429200;2,1940052836;1,9828755465;1,3512212526;0,9119036862;1,1992598500;1,6390792461;1,3111102480;1,3791376628;1,8528924678;
EST;Estonie;Horaires de travail lourds;Horaires de travail lourds;PT_SAL;Pourcentage de salariés;HSL_2;Travail et qualité de l'emploi;4,9900000000;4,9600000000;5,3900000000;4,9200000000;3,5800000000;2,9100000000;3,6300000000;4,0700000000;3,5800000000;3,3000000000;3,2900000000;3,3100000000;2,6400000000;2,4200000000;2,7000000000;2,5800000000;2,1800000000;2,1000000000;1,5100000000;1,3700000000;1,9600000000;
EST;Estonie;Taux d’emploi;Taux d’emploi;PT_POP_Y25T64;Pourcentage de la population âgée de 25 à 64 ans;HSL_2;Travail et qualité de l'emploi;71,9750000000;73,7130000000;78,3920000000;79,2320000000;79,0710000000;72,8200000000;70,0320000000;73,3800000000;74,9050000000;76,1050000000;76,7440000000;78,4440000000;78,2350000000;79,9900000000;80,4280000000;81,2870000000;80,7100000000;81,0020000000;83,4530000000;83,5920000000;83,4150000000;
EST;Estonie;Salaire brut annuel moyen;Salaire brut annuel moyen;USD_PPP;Dollars des É-U, PPA convertis;HSL_2;Travail et qualité de l'emploi;21019,3740000000;22420,1170000000;24478,2240000000;28452,5460000000;28825,2410000000;28129,3720000000;27819,1440000000;27175,8010000000;27586,8790000000;28264,0410000000;29821,5700000000;31216,8660000000;32810,9220000000;33537,4110000000;35721,4430000000;37497,1800000000;39457,7200000000;41669,4190000000;38592,0760000000;38139,9950000000;38974,8280000000;
EST;Estonie;Revenu disponible ajusté net des ménages et des ISBLSM par habitant;Revenu disponible ajusté net des ménages et des ISBLSM par habitant;USD_PPP_PS;Dollars des É-U par personne, PPA convertis;HSL_1;Revenu et patrimoine;15284,0000000000;16893,0000000000;19077,0000000000;20558,0000000000;21986,0000000000;20470,0000000000;19742,0000000000;20436,0000000000;20486,0000000000;21705,0000000000;22323,0000000000;23750,0000000000;24439,0000000000;25103,0000000000;27045,0000000000;27813,0000000000;28641,0000000000;29830,0000000000;28807,0000000000;28128,0000000000;28955,0000000000;
EST;Estonie;Ménages disposant d’un accès internet;Ménages disposant d’un accès internet;PT_HH;Pourcentage de ménages;HSL_3;Logement;;28,4090000000;36,3961000000;46,8177000000;53,7733000000;60,9001000000;63,6351000000;64,9389000000;73,0381000000;78,4193000000;81,2006000000;86,9123000000;85,2947000000;87,3577000000;89,2878000000;89,9997000000;89,1093000000;90,8716000000;;;;
EST;Estonie;Tension au travail;Tension au travail;PT_SAL;Pourcentage de salariés;HSL_2;Travail et qualité de l'emploi;;30,6999301910;;;;;31,7543029785;;;;;23,0036048889;;;;;;;;;;
EST;Estonie;Compétences des élèves en compréhension de l’écrit;Compétences des élèves en compréhension de l’écrit;PO;Points;HSL_6;Savoirs et compétences;;;500,7497617929;;;500,9618654468;;;516,2941844145;;;519,1428550009;;;523,0170183682;;;;511,0300000000;;;
EST;Estonie;Compétences des élèves en sciences;Compétences des élèves en sciences;PO;Points;HSL_6;Savoirs et compétences;;;531,3918043108;;;527,8317560592;;;541,4047575381;;;534,1937420772;;;530,1080045754;;;;525,8100000000;;;
EST;Estonie;Compétences des élèves en mathématiques;Compétences des élèves en mathématiques;PO;Points;HSL_6;Savoirs et compétences;;;514,5754617023;;;512,1041973931;;;520,5455215841;;;519,5291323081;;;523,4145801867;;;;509,9500000000;;;
EST;Estonie;Bilan émotionnel négatif;Bilan émotionnel négatif;PT_POP_Y_GE15;Pourcentage de la population âgée de 15 ans ou plus;HSL_11;Bien-être subjectif;;;16,7493113811;16,7493113811;18,5888783834;18,5888783834;;14,4236464115;14,4236464115;14,4236464115;13,2204950852;13,2204950852;13,2204950852;9,5595223970;9,5595223970;9,5595223970;8,7207505080;8,7207505080;8,7692763368;8,7692763368;;
EST;Estonie;Douleur physique;Douleur physique;PT_POP_Y_GE15;Pourcentage de la population âgée de 15 ans ou plus;HSL_11;Bien-être subjectif;;;17,5000000000;17,5000000000;18,5000000000;18,5000000000;;21,0000000000;21,0000000000;21,0000000000;21,3333333333;21,3333333333;21,3333333333;21,3333333333;21,3333333333;21,3333333333;20,3333333333;20,3333333333;20,3333333333;23,0000000000;23,0000000000;
EST;Estonie;Sentiment d’insécurité la nuit;Sentiment d’insécurité la nuit;PT_POP_Y_GE15;Pourcentage de la population âgée de 15 ans ou plus;HSL_10;Sécurité;;;35,0000000000;35,0000000000;34,5000000000;34,5000000000;;30,3333333333;30,3333333333;30,3333333333;26,0000000000;26,0000000000;26,0000000000;18,3333333333;18,3333333333;18,3333333333;13,0000000000;13,0000000000;13,0000000000;12,0000000000;12,0000000000;
EST;Estonie;Sentiment de sécurité la nuit;Sentiment de sécurité la nuit;PT_POP_Y_GE15;Pourcentage de la population âgée de 15 ans ou plus;HSL_10;Sécurité;;;56,0000000000;56,0000000000;60,0000000000;60,0000000000;;60,3333333333;60,3333333333;60,3333333333;67,3333333333;67,3333333333;67,3333333333;72,3333333333;72,3333333333;72,3333333333;78,0000000000;78,0000000000;78,0000000000;84,0000000000;84,0000000000;
EST;Estonie;Soutien social;Soutien social;PT_POP_Y_GE15;Pourcentage de la population âgée de 15 ans ou plus;HSL_7;Liens sociaux;;;85,4354082154;85,4354082154;86,2222084752;86,2222084752;;87,7182627287;87,7182627287;87,7182627287;90,4767209722;90,4767209722;90,4767209722;91,8760315835;91,8760315835;91,8760315835;93,4887706102;93,4887706102;93,4887706102;93,3480595985;93,3480595985;
EST;Estonie;Manque de soutien social;Manque de soutien social;PT_POP_Y_GE15;Pourcentage de la population âgée de 15 ans ou plus;HSL_7;Liens sociaux;;;9,1937970234;9,1937970234;10,7905825795;10,7905825795;;9,7822665832;9,7822665832;9,7822665832;7,4141695831;7,4141695831;7,4141695831;6,4762101682;6,4762101682;6,4762101682;5,3690730863;5,3690730863;5,3690730863;6,0586954753;6,0586954753;
EST;Estonie;Salariés à temps plein dont la rémunération est inférieure à deux tiers du salaire brut médian;Salariés à temps plein dont la rémunération est inférieure à deux tiers du salaire brut médian;PT_SAL_FT;Pourcentage de salariés à plein temps;HSL_2;Travail et qualité de l'emploi;;;20,7916666700;;;;21,4444444400;;;;20,4285714300;;;;19,7083333300;;;;19,4723797900;18,2616729300;;
EST;Estonie;Écart de rémunération entre les genres;Écart de rémunération entre les genres;PT_WG_SAL_M_D;Pourcentage du salaire des hommes dans le même décile;HSL_2;Travail et qualité de l'emploi;;;27,8560250400;;;;27,7978339400;;;;28,3393501800;;;;22,6811594200;;;;21,4245965500;24,6517090700;;
EST;Estonie;Décile supérieur de la rémunération des salariés à temps plein;Décile supérieur de la rémunération des salariés à temps plein;FCTR_D1_EARN;Facteur de décile des gains les plus bas;HSL_2;Travail et qualité de l'emploi;;;4,2900763360;;;;4,0533707870;;;;3,7849686850;;;;3,5384615390;3,6437728940;3,5172966480;3,4407279880;3,4580498870;3,4361522960;;
EST;Estonie;Participation électorale;Participation électorale;PT_VOTES;Pourcentage des votes;HSL_8;Engagement civique;;;;61,9100000000;;;;63,5300000000;;;;64,2300000000;;;;63,6700000000;;;;63,5300000000;;
EST;Estonie;Insécurité sur le marché du travail;Insécurité sur le marché du travail;PT_EARN_PRVS_LST;Pourcentage des gains antérieurs perdus;HSL_2;Travail et qualité de l'emploi;;;;4,3855619431;4,9828019142;10,7681465149;13,8175096512;10,9831600189;8,7979030609;7,2961955070;6,1815867424;4,9999465942;5,4165830612;;;;;;;;;
EST;Estonie;Temps consacré aux interactions sociales;Temps consacré aux interactions sociales;H_WK;Heures par semaine;HSL_7;Liens sociaux;;;;;;4,2000000000;;;;;;;;;;;;;;;;
EST;Estonie;Temps libre;Temps libre;H_D;Heures par jour;HSL_4;Equilibre travail-vie;;;;;;14,9833333333;;;;;;;;;;;;;;;;
EST;Estonie;Écart entre les genres en termes de temps de travail;Écart entre les genres en termes de temps de travail;MN_D;Minutes par jour;HSL_4;Equilibre travail-vie;;;;;;67,7446534572;;;;;;;;;;;;;;;;
