FRA;France;Faible compétences dans les trois domaines évalués par le PISA;Faible compétences dans les trois domaines évalués par le PISA;PT_ST;Pourcentage de dépenses chez le même prestataire;HSL_6;Savoirs et compétences;;;;;;;;;;;;;;;12,5238017754;;;;16,7966109163;;;
FRA;France;Sentiment de solitude;Sentiment de solitude;PT_POP_Y_GE16;Pourcentage de la population âgée de 16 ans ou plus;HSL_7;Liens sociaux;;;;;;;;;;;;;;;7,1376639435;;;;10,7731529161;;;
FRA;France;Quintile supérieur du revenu disponible moyen des ménages;Quintile supérieur du revenu disponible moyen des ménages;FCTR_Q1_INC;Facteur de quintile des revenus les plus bas;HSL_1;Revenu et patrimoine;;;;;;;;;;;;;;;;;4,0890196078;4,5415309446;4,4866207951;;;
FRA;France;Revenu disponible des ménages inférieur au seuil de pauvreté monétaire relative;Revenu disponible des ménages inférieur au seuil de pauvreté monétaire relative;PT_POP;Pourcentage de la population;HSL_1;Revenu et patrimoine;;;;;;;;;;;;;;;;;7,7000000000;8,5000000000;8,3000000000;;;
FRA;France;Avoir son mot à dire concernant l’action des pouvoirs publics;Avoir son mot à dire concernant l’action des pouvoirs publics;PT_POP_Y16T65;Pourcentage de la population âgée de 16 à 65 ans;HSL_8;Engagement civique;;;;;;;;;;;;;;;;;;25,7484280000;;26,2662070000;;
FRA;France;Ne pas avoir son mot à dire concernant l’action des pouvoirs publics;Ne pas avoir son mot à dire concernant l’action des pouvoirs publics;PT_POP_Y16T65;Pourcentage de la population âgée de 16 à 65 ans;HSL_8;Engagement civique;;;;;;;;;;;;;;;;;;53,2191000000;;57,6200940000;;
GRC;Grèce;Accessibilité financière du logement;Accessibilité financière du logement;PT_B7G_S14;Pourcentage du revenu disponible brut ajusté des ménages;HSL_3;Logement;82,1246990243;80,8594225142;81,4247719240;81,4796329310;80,5114387103;80,3924011531;78,5207500092;76,1980459609;74,8727455826;75,0187649993;76,2243395044;76,4714104175;76,3241115602;76,1936281868;76,2457359488;76,8166724362;75,2878605690;75,8186770853;74,7766272299;76,0514500245;75,9415972826;
GRC;Grèce;Participation électorale;Participation électorale;PT_VOTES;Pourcentage des votes;HSL_8;Engagement civique;76,6200000000;;;74,1400000000;;70,9200000000;;;62,4700000000;;;63,9400000000;;;;57,7800000000;;;;61,1000000000;;
GRC;Grèce;Quintile supérieur du revenu disponible moyen des ménages;Quintile supérieur du revenu disponible moyen des ménages;FCTR_Q1_INC;Facteur de quintile des revenus les plus bas;HSL_1;Revenu et patrimoine;5,6601369594;5,9495236545;5,7704173894;5,5982717708;5,5720840228;5,5972453469;5,9368725903;6,1573392194;6,2519881402;6,2896444747;6,3408328507;6,3698495151;6,0060594302;5,3893730935;4,9739515304;5,1167659002;5,5557981716;5,1320087412;5,1561874311;;;
GRC;Grèce;Espérance de vie à la naissance;Espérance de vie à la naissance;Y;Années;HSL_5;Santé;79,4000000000;79,6000000000;79,9000000000;79,7000000000;80,2000000000;80,4000000000;80,6000000000;80,8000000000;80,7000000000;81,4000000000;81,5000000000;81,1000000000;81,5000000000;81,4000000000;81,9000000000;81,7000000000;81,4000000000;80,2000000000;80,8000000000;81,8000000000;;
GRC;Grèce;Mortalité routière;Mortalité routière;DT_10P5HB;Décès pour 100 000 d'habitants;HSL_10;Sécurité;15,2439845400;15,0901303100;15,0358037200;14,5902515200;14,0189771600;13,1088302100;11,3115855400;10,2747445100;8,9452151750;8,0162616110;7,2986582500;7,3284222740;7,6466427020;6,7970415480;6,5220133790;6,4169634670;5,4586586520;5,9039434080;6,2722267240;6,1478801640;;
GRC;Grèce;Homicides;Homicides;DT_10P5HB;Décès pour 100 000 d'habitants;HSL_10;Sécurité;0,9000000000;1,0000000000;0,8000000000;1,1000000000;1,3000000000;1,4000000000;1,4000000000;1,6000000000;1,5000000000;1,4000000000;1,0000000000;0,9000000000;0,8000000000;0,8000000000;1,0000000000;0,9000000000;0,8000000000;0,8000000000;0,8000000000;;;
GRC;Grèce;Revenu disponible des ménages inférieur au seuil de pauvreté monétaire relative;Revenu disponible des ménages inférieur au seuil de pauvreté monétaire relative;PT_POP;Pourcentage de la population;HSL_1;Revenu et patrimoine;11,9646968136;12,8698541784;12,7341248214;13,2285627581;12,8708328899;12,9031582653;14,0558996133;15,0551683416;14,9295378050;15,1168241265;14,7674393835;14,9392804199;14,3885404408;12,6336310031;12,0841151818;11,4854501360;12,9562026504;11,6565180766;11,1635789168;;;
GRC;Grèce;Exposition à des températures extrêmes;Exposition à des températures extrêmes;PT_POP;Pourcentage de la population;HSL_9;Qualité environnementale;0,3542887844;0,3574179272;1,1379440163;49,6476580783;11,6284085933;1,1450244887;31,9567686275;0,3587622194;49,7355910083;2,5014677569;31,8045671365;2,9399737310;1,8542991006;23,2890955473;0,0000000000;6,5948223431;1,6731470862;52,9597613231;4,1515446567;40,6297918599;;
GRC;Grèce;Exposition à la pollution de l’air;Exposition à la pollution de l’air;PT_POP;Pourcentage de la population;HSL_9;Qualité environnementale;99,6904370000;99,6901170000;99,6901700000;99,6902310000;99,6902850000;99,6903460000;99,6904070000;99,6909870000;99,6915740000;99,6921690000;99,6927720000;99,6933750000;99,6931380000;99,6929090000;99,6926730000;99,6924360000;99,6922000000;;;;;
GRC;Grèce;Incapacité à maintenir le logement à bonne température;Incapacité à maintenir le logement à bonne température;PT_POP_Y_GE16;Pourcentage de la population âgée de 16 ans ou plus;HSL_3;Logement;16,8000000000;15,7000000000;12,0000000000;13,8000000000;15,4000000000;15,7000000000;15,4000000000;18,6000000000;26,1000000000;29,5000000000;32,9000000000;29,2000000000;29,1000000000;25,7000000000;22,7000000000;17,9000000000;17,1000000000;17,5000000000;18,7000000000;19,2000000000;19,0000000000;
GRC;Grèce;Difficultés à joindre les deux bouts;Difficultés à joindre les deux bouts;PT_POP_Y_GE16;Pourcentage de la population âgée de 16 ans ou plus;HSL_1;Revenu et patrimoine;45,4000000000;50,8000000000;52,6000000000;52,4000000000;54,5000000000;57,0000000000;58,4000000000;62,6000000000;73,1000000000;78,3000000000;78,1000000000;77,7000000000;76,8000000000;77,2000000000;74,1000000000;71,0000000000;69,8000000000;71,0000000000;68,4000000000;67,0000000000;66,7000000000;
GRC;Grèce;État de santé perçu comme bon;État de santé perçu comme bon;PT_POP_Y_GE16;Pourcentage de la population âgée de 16 ans ou plus;HSL_5;Santé;77,7000000000;77,4000000000;76,7000000000;76,6000000000;76,0000000000;75,3000000000;75,5000000000;76,4000000000;74,9000000000;73,9000000000;73,5000000000;74,4000000000;73,9000000000;74,0000000000;76,2000000000;79,1000000000;78,4000000000;78,2000000000;77,1000000000;78,2000000000;78,2000000000;
GRC;Grèce;État de santé perçu comme mauvais;État de santé perçu comme mauvais;PT_POP_Y_GE16;Pourcentage de la population âgée de 16 ans ou plus;HSL_5;Santé;8,9000000000;8,9000000000;9,2000000000;8,8000000000;9,4000000000;9,7000000000;9,7000000000;9,0000000000;9,3000000000;10,5000000000;10,8000000000;10,0000000000;10,4000000000;10,4000000000;9,3000000000;6,6000000000;6,8000000000;6,5000000000;7,5000000000;6,8000000000;7,0000000000;
GRC;Grèce;Taux de chômage de longue durée;Taux de chômage de longue durée;PT_LF;Pourcentage des dépenses de santé;HSL_2;Travail et qualité de l'emploi;5,6826393555;5,2641590131;4,9524364042;4,2377337366;3,7128835712;3,9529381608;5,7736566801;8,9580419537;14,6055377453;18,6153396733;19,6477939212;18,3702424964;17,0641242230;15,7608073477;13,6943395122;12,2567852999;10,9675192528;9,2827019884;7,7714584938;6,2501948976;5,4785767615;
GRC;Grèce;Horaires de travail lourds;Horaires de travail lourds;PT_SAL;Pourcentage de salariés;HSL_2;Travail et qualité de l'emploi;6,7600000000;6,6700000000;6,0300000000;5,5700000000;5,5700000000;5,6000000000;5,1500000000;5,1700000000;5,6300000000;6,1100000000;6,3700000000;6,5900000000;7,3600000000;6,4800000000;5,7300000000;5,1200000000;4,4800000000;4,2400000000;3,9100000000;3,5700000000;3,2100000000;
GRC;Grèce;Taux d’emploi;Taux d’emploi;PT_POP_Y25T64;Pourcentage de la population âgée de 25 à 64 ans;HSL_2;Travail et qualité de l'emploi;66,5820000000;67,4710000000;68,5430000000;68,6720000000;69,1220000000;68,3480000000;66,6050000000;62,4660000000;57,8920000000;55,6430000000;56,0450000000;57,6440000000;59,1010000000;60,5530000000;62,2880000000;64,1010000000;64,0430000000;65,3890000000;69,0700000000;70,0400000000;71,9810000000;
GRC;Grèce;Salaire brut annuel moyen;Salaire brut annuel moyen;USD_PPP;Dollars des É-U, PPA convertis;HSL_2;Travail et qualité de l'emploi;41242,8180000000;41105,1380000000;41594,0700000000;41601,7510000000;40957,9260000000;42891,3590000000;40933,4370000000;38335,7010000000;36104,3420000000;33745,9860000000;33606,4240000000;33936,9510000000;33157,5890000000;33370,1470000000;31829,6510000000;31882,6270000000;31976,2970000000;32289,4690000000;31456,5770000000;31597,6800000000;32257,1120000000;
GRC;Grèce;Revenu disponible ajusté net des ménages et des ISBLSM par habitant;Revenu disponible ajusté net des ménages et des ISBLSM par habitant;USD_PPP_PS;Dollars des É-U par personne, PPA convertis;HSL_1;Revenu et patrimoine;30103,0000000000;30076,0000000000;31659,0000000000;32622,0000000000;33639,0000000000;33542,0000000000;29469,0000000000;26197,0000000000;22876,0000000000;21754,0000000000;22114,0000000000;22891,0000000000;23062,0000000000;23239,0000000000;23291,0000000000;25110,0000000000;24551,0000000000;26890,0000000000;26971,0000000000;28369,0000000000;28883,0000000000;
GRC;Grèce;Jeunes sans emploi et sortis du système éducatif;Jeunes sans emploi et sortis du système éducatif;PT_POP_Y15T24;Pourcentage de la population âgée de 15 à 24 ans;HSL_2;Travail et qualité de l'emploi;17,1883200000;17,0023160000;13,2158440000;13,1297790000;12,6061090000;13,0404400000;14,3963070000;16,2719750000;20,3224370000;20,9296340000;20,7959060000;18,2901630000;16,4403500000;16,1269250000;15,1427910000;13,9132640000;13,0009890000;12,7744160000;11,0442910000;13,5332040000;12,2275266647;
GRC;Grèce;Ménages disposant d’un accès internet;Ménages disposant d’un accès internet;PT_HH;Pourcentage de ménages;HSL_3;Logement;;0,6206000000;3,8370000000;7,4610000000;22,4580000000;33,1417000000;41,1810000000;45,3808000000;50,5042000000;55,0208000000;64,6603000000;67,0966000000;68,0573000000;70,6434000000;76,1250000000;78,0646000000;79,9556000000;84,9847000000;;;;
GRC;Grèce;Tension au travail;Tension au travail;PT_SAL;Pourcentage de salariés;HSL_2;Travail et qualité de l'emploi;;49,7841644287;;;;;46,8541526794;;;;;47,9370689392;;;;;;;;;;
GRC;Grèce;Compétences des élèves en compréhension de l’écrit;Compétences des élèves en compréhension de l’écrit;PO;Points;HSL_6;Savoirs et compétences;;;459,7111846930;;;482,7762417979;;;477,1971766013;;;467,0395379118;;;457,4143947657;;;;438,4400000000;;;
GRC;Grèce;Compétences des élèves en sciences;Compétences des élèves en sciences;PO;Points;HSL_6;Savoirs et compétences;;;473,3779639765;;;470,1157642340;;;466,7220301428;;;454,8288165948;;;451,6327415700;;;;440,7900000000;;;
GRC;Grèce;Compétences des élèves en mathématiques;Compétences des élèves en mathématiques;PO;Points;HSL_6;Savoirs et compétences;;;459,2019867160;;;466,0963726612;;;452,9734269959;;;453,6298506957;;;451,3703438079;;;;430,1500000000;;;
GRC;Grèce;Bilan émotionnel négatif;Bilan émotionnel négatif;PT_POP_Y_GE15;Pourcentage de la population âgée de 15 ans ou plus;HSL_11;Bien-être subjectif;;;14,7198376180;14,7198376180;;16,4857798042;16,4857798042;26,7249043373;26,7249043373;26,7249043373;21,1381912856;21,1381912856;21,1381912856;19,5085177680;19,5085177680;19,5085177680;21,2556875182;21,2556875182;17,9928527334;17,9928527334;;
GRC;Grèce;Douleur physique;Douleur physique;PT_POP_Y_GE15;Pourcentage de la population âgée de 15 ans ou plus;HSL_11;Bien-être subjectif;;;24,5000000000;24,5000000000;;27,5000000000;27,5000000000;28,6666666667;28,6666666667;28,6666666667;29,0000000000;29,0000000000;29,0000000000;29,6666666667;29,6666666667;29,6666666667;28,3333333333;28,3333333333;28,3333333333;34,5000000000;34,5000000000;
GRC;Grèce;Sentiment d’insécurité la nuit;Sentiment d’insécurité la nuit;PT_POP_Y_GE15;Pourcentage de la population âgée de 15 ans ou plus;HSL_10;Sécurité;;;37,5000000000;37,5000000000;;44,0000000000;44,0000000000;49,0000000000;49,0000000000;49,0000000000;37,3333333333;37,3333333333;37,3333333333;42,6666666667;42,6666666667;42,6666666667;33,0000000000;33,0000000000;33,0000000000;36,0000000000;36,0000000000;
GRC;Grèce;Sentiment de sécurité la nuit;Sentiment de sécurité la nuit;PT_POP_Y_GE15;Pourcentage de la population âgée de 15 ans ou plus;HSL_10;Sécurité;;;60,5000000000;60,5000000000;;55,5000000000;55,5000000000;51,0000000000;51,0000000000;51,0000000000;62,0000000000;62,0000000000;62,0000000000;56,6666666667;56,6666666667;56,6666666667;66,3333333333;66,3333333333;66,3333333333;64,0000000000;64,0000000000;
GRC;Grèce;Soutien social;Soutien social;PT_POP_Y_GE15;Pourcentage de la population âgée de 15 ans ou plus;HSL_7;Liens sociaux;;;81,4500718594;81,4500718594;;82,5598357005;82,5598357005;78,0013698994;78,0013698994;78,0013698994;82,2602538988;82,2602538988;82,2602538988;80,9771264191;80,9771264191;80,9771264191;83,3448182558;83,3448182558;83,3448182558;81,1864005228;81,1864005228;
GRC;Grèce;Manque de soutien social;Manque de soutien social;PT_POP_Y_GE15;Pourcentage de la population âgée de 15 ans ou plus;HSL_7;Liens sociaux;;;17,6055944561;17,6055944561;;16,8154628466;16,8154628466;21,5420579647;21,5420579647;21,5420579647;17,6605854264;17,6605854264;17,6605854264;18,7092226142;18,7092226142;18,7092226142;16,5067234444;16,5067234444;16,5067234444;18,5525041777;18,5525041777;
GRC;Grèce;Salariés à temps plein dont la rémunération est inférieure à deux tiers du salaire brut médian;Salariés à temps plein dont la rémunération est inférieure à deux tiers du salaire brut médian;PT_SAL_FT;Pourcentage de salariés à plein temps;HSL_2;Travail et qualité de l'emploi;;;15,7777777800;;;;12,5476190500;;;;15,9607843100;;;;16,4285714300;;;;10,5445128000;9,1491731280;;
GRC;Grèce;Écart de rémunération entre les genres;Écart de rémunération entre les genres;PT_WG_SAL_M_D;Pourcentage du salaire des hommes dans le même décile;HSL_2;Travail et qualité de l'emploi;;;17,7257525100;;;;9,9099099100;;;;7,1715817690;;;;5,9090909090;;;;8,5972850680;9,6949998630;;
GRC;Grèce;Décile supérieur de la rémunération des salariés à temps plein;Décile supérieur de la rémunération des salariés à temps plein;FCTR_D1_EARN;Facteur de décile des gains les plus bas;HSL_2;Travail et qualité de l'emploi;;;3,3408820020;;;;2,9949596770;;;;3,3072060680;;;;3,4580369840;3,3635489630;3,3470525760;3,4796411320;3,2065217390;3,0316203160;;
GRC;Grèce;Insécurité sur le marché du travail;Insécurité sur le marché du travail;PT_EARN_PRVS_LST;Pourcentage des gains antérieurs perdus;HSL_2;Travail et qualité de l'emploi;;;;6,6416344643;6,9771809578;10,3634052277;10,6697282791;14,8433609009;20,7899551392;22,6806240082;25,2797355652;22,9893646240;21,6767902374;;;;;;;;;
GRC;Grèce;Décile supérieur des ménages les plus riches;Décile supérieur des ménages les plus riches;PT_B90_S14;Pourcentage de la richesse des ménages;HSL_1;Revenu et patrimoine;;;;;;38,7841835022;;;;;42,4240417480;;;;41,2840843201;;;41,2822341919;;;;
GRC;Grèce;Patrimoine net médian;Patrimoine net médian;USD_HH_PPP;Dollars des É-U par ménage, PPA convertis;HSL_1;Revenu et patrimoine;;;;;;202451,0000000000;;;;;120325,0000000000;;;;111975,0000000000;;;157481,0000000000;;;;
GRC;Grèce;Patrimoine financier liquide équivalent insuffisant pour se maintenir au-dessus du seuil national annuel de pauvreté monétaire relative pendant trois mois;Patrimoine financier liquide équivalent insuffisant pour se maintenir au-dessus du seuil national annuel de pauvreté monétaire relative pendant trois mois;PT_POP;Pourcentage de la population;HSL_1;Revenu et patrimoine;;;;;;57,8573584557;;;;;66,1698281765;;;;69,7144210339;;;51,9877076149;;;;
GRC;Grèce;Ménages vivant dans des logements surpeuplés;Ménages vivant dans des logements surpeuplés;PT_HH;Pourcentage de ménages;HSL_3;Logement;;;;;;;19,0945625305;18,9792782068;19,9897781014;18,6488971114;18,6581268907;18,2267114520;18,0864721537;17,7898079157;17,9696246982;18,0761218071;17,9050490260;18,2179078460;17,9471060634;16,8503820896;16,8840050697;
GRC;Grèce;Surcharge financière liée au coût du logement;Surcharge financière liée au coût du logement;PT_POP;Pourcentage de la population;HSL_3;Logement;;;;;;;27,4314254522;35,2254450321;41,3052082062;43,9475506544;41,8758094311;39,5339041948;41,5390014648;37,9534810781;31,2073737383;29,1953563690;24,3270680308;30,4749250412;25,2614080906;;;
GRC;Grèce;Temps consacré aux interactions sociales;Temps consacré aux interactions sociales;H_WK;Heures par semaine;HSL_7;Liens sociaux;;;;;;;;;7,0000000000;;;;;;;;;;;;;
GRC;Grèce;Accès à des espaces verts;Accès à des espaces verts;PT_POP_URB;Pourcentage de population urbaine;HSL_9;Qualité environnementale;;;;;;;;;69,4699150404;;;;;;69,0422164376;;;;;;;
GRC;Grèce;Quintile supérieur de la satisfaction à l’égard de la vie;Quintile supérieur de la satisfaction à l’égard de la vie;FCTR_Q1_SCR_LIFE_SATISFACTION;Facteur de quintile de satisfaction à l'égard de la vie les plus bas;HSL_11;Bien-être subjectif;;;;;;;;;;3,5971273168;;;;;2,6088478159;;;2,3991817728;2,4274971294;2,3373602237;2,6133210350;
GRC;Grèce;Quintile supérieur de la satisfaction à l’égard des relations personnelles;Quintile supérieur de la satisfaction à l’égard des relations personnelles;FCTR_Q1_SCR_PERS_REL_SATISFACTION;Facteur de quintile de satisfaction des relations personnelle les plus bas;HSL_7;Liens sociaux;;;;;;;;;;2,6037477888;;;;;2,2441804877;;;;2,3121884801;;;
GRC;Grèce;Temps libre;Temps libre;H_D;Heures par jour;HSL_4;Equilibre travail-vie;;;;;;;;;;15,0333333333;;;;;;;;;;;;
GRC;Grèce;Écart entre les genres en termes de temps de travail;Écart entre les genres en termes de temps de travail;MN_D;Minutes par jour;HSL_4;Equilibre travail-vie;;;;;;;;;;67,4953327785;;;;;;;;;;;;
GRC;Grèce;Quintile supérieur de la satisfaction à l’égard de l’emploi du temps;Quintile supérieur de la satisfaction à l’égard de l’emploi du temps;FCTR_Q1_SCR_TIME_USE;Facteur de quintile de satisfaction à l'égard de l'utilisation du temps les plus bas;HSL_4;Equilibre travail-vie;;;;;;;;;;3,2305757677;;;;;4,5505398806;;;;5,2236124317;;;
GRC;Grèce;Satisfaction à l’égard de la vie;Satisfaction à l’égard de la vie;0_TO_10;Échelle 0-10;HSL_11;Bien-être subjectif;;;;;;;;;;6,1600323929;;;;;6,4376863334;;;6,7659425326;6,7307896823;6,8624746368;6,7376669607;
GRC;Grèce;Satisfaction à l’égard de l’emploi du temps;Satisfaction à l’égard de l’emploi du temps;0_TO_10;Échelle 0-10;HSL_4;Equilibre travail-vie;;;;;;;;;;6,1101835595;;;;;5,5477643726;;;;5,5003671178;;;
GRC;Grèce;Satisfaction à l’égard des relations personnelles;Satisfaction à l’égard des relations personnelles;0_TO_10;Échelle 0-10;HSL_7;Liens sociaux;;;;;;;;;;7,0109989499;;;;;7,0797476746;;;;7,2637586877;;;
GRC;Grèce;Satisfaction à l’égard des relations personnelles inférieure à 5;Satisfaction à l’égard des relations personnelles inférieure à 5;PT_POP_Y_GE16;Pourcentage de la population âgée de 16 ans ou plus;HSL_7;Liens sociaux;;;;;;;;;;11,2878218484;;;;;7,2456120107;;;;9,3314777746;;;
GRC;Grèce;Satisfaction à l’égard de l’emploi du temps inférieure à 5;Satisfaction à l’égard de l’emploi du temps inférieure à 5;PT_POP_Y_GE16;Pourcentage de la population âgée de 16 ans ou plus;HSL_4;Equilibre travail-vie;;;;;;;;;;19,4659562008;;;;;25,2076609077;;;;30,2196942304;;;
GRC;Grèce;Satisfaction à l’égard de la vie inférieure à 5;Satisfaction à l’égard de la vie inférieure à 5;PT_POP_Y_GE16;Pourcentage de la population âgée de 16 ans ou plus;HSL_11;Bien-être subjectif;;;;;;;;;;19,8101752638;;;;;12,7267558984;;;11,2300003472;11,5594746247;10,8253735068;13,1560622572;
GRC;Grèce;Satisfaction au travail;Satisfaction au travail;0_TO_10;Échelle 0-10;HSL_2;Travail et qualité de l'emploi;;;;;;;;;;6,1067919955;;;;;6,2435931650;;;;;6,7928710024;;
GRC;Grèce;Décile supérieur des résultats des adultes en calcul;Décile supérieur des résultats des adultes en calcul;FCTR_D1_SCR;Facteur de décile des scores les plus bas;HSL_6;Savoirs et compétences;;;;;;;;;;;1,6440469027;;;;;;;;;;;
GRC;Grèce;Décile supérieur des résultats des adultes en lecture et écriture;Décile supérieur des résultats des adultes en lecture et écriture;FCTR_D1_SCR;Facteur de décile des scores les plus bas;HSL_6;Savoirs et compétences;;;;;;;;;;;1,6030876637;;;;;;;;;;;
GRC;Grèce;Adultes ayant de faibles compétences en calcul;Adultes ayant de faibles compétences en calcul;PT_ST;Pourcentage de dépenses chez le même prestataire;HSL_6;Savoirs et compétences;;;;;;;;;;;19,5235890000;;;;;;;;;;;
GRC;Grèce;Décès dus au suicide, à l’alcool ou à la drogue;Décès dus au suicide, à l’alcool ou à la drogue;DT_10P5HB;Décès pour 100 000 d'habitants;HSL_5;Santé;;;;;;;;;;;10,5625140828;10,8825624879;10,3707962977;10,7271609254;11,1984713203;10,8166921649;10,2357767400;10,5189851084;;;;
GRC;Grèce;Cas autodéclarés de dépression;Cas autodéclarés de dépression;PT_POP_Y_GE15;Pourcentage de la population âgée de 15 ans ou plus;HSL_5;Santé;;;;;;;;;;;4,4000000000;;;;;2,6000000000;;;;;;
GRC;Grèce;Décile supérieur des résultats en compréhension de l’écrit;Décile supérieur des résultats en compréhension de l’écrit;FCTR_D1_SCR;Facteur de décile des scores les plus bas;HSL_6;Savoirs et compétences;;;;;;;;;;;;;;;1,7869488001;;;;1,7773294252;;;
GRC;Grèce;Décile supérieur des résultats en mathématiques;Décile supérieur des résultats en mathématiques;FCTR_D1_SCR;Facteur de décile des scores les plus bas;HSL_6;Savoirs et compétences;;;;;;;;;;;;;;;1,6921724081;;;;1,6643994126;;;
GRC;Grèce;Décile supérieur des résultats en sciences;Décile supérieur des résultats en sciences;FCTR_D1_SCR;Facteur de décile des scores les plus bas;HSL_6;Savoirs et compétences;;;;;;;;;;;;;;;1,6595609188;;;;1,7309711647;;;
GRC;Grèce;Faible compétences dans les trois domaines évalués par le PISA;Faible compétences dans les trois domaines évalués par le PISA;PT_ST;Pourcentage de dépenses chez le même prestataire;HSL_6;Savoirs et compétences;;;;;;;;;;;;;;;19,8741200372;;;;25,7423579048;;;
GRC;Grèce;Sentiment de solitude;Sentiment de solitude;PT_POP_Y_GE16;Pourcentage de la population âgée de 16 ans ou plus;HSL_7;Liens sociaux;;;;;;;;;;;;;;;6,2959517933;;;;7,1934888418;;;
GRC;Grèce;Avoir son mot à dire concernant l’action des pouvoirs publics;Avoir son mot à dire concernant l’action des pouvoirs publics;PT_POP_Y16T65;Pourcentage de la population âgée de 16 à 65 ans;HSL_8;Engagement civique;;;;;;;;;;;;;;;;;;;;21,1749360000;;
GRC;Grèce;Ne pas avoir son mot à dire concernant l’action des pouvoirs publics;Ne pas avoir son mot à dire concernant l’action des pouvoirs publics;PT_POP_Y16T65;Pourcentage de la population âgée de 16 à 65 ans;HSL_8;Engagement civique;;;;;;;;;;;;;;;;;;;;63,8231180000;;
IRL;Irlande;Accessibilité financière du logement;Accessibilité financière du logement;PT_B7G_S14;Pourcentage du revenu disponible brut ajusté des ménages;HSL_3;Logement;80,2880403843;80,8691930276;80,5696964439;79,8421414237;79,9260951286;81,8645798349;81,8929868295;81,5884963850;81,4427036911;80,8495857069;80,1195668061;79,7829561056;80,0545676274;79,9831513414;79,2608981962;79,8312973534;81,0715366907;80,5880307401;78,7696276635;79,4864407226;80,7945195146;
IRL;Irlande;Quintile supérieur du revenu disponible moyen des ménages;Quintile supérieur du revenu disponible moyen des ménages;FCTR_Q1_INC;Facteur de quintile des revenus les plus bas;HSL_1;Revenu et patrimoine;5,1661673302;5,0677976283;4,9586253323;4,6266108956;4,4583604722;4,8519454214;4,6285355815;4,8546314499;4,8234909320;4,9071573373;4,5571562436;4,5281461115;4,7466210388;4,4220731224;4,2906535610;4,3281718089;4,1283824597;4,3604624785;4,1543370300;;;
IRL;Irlande;Espérance de vie à la naissance;Espérance de vie à la naissance;Y;Années;HSL_5;Santé;78,6000000000;79,0000000000;79,3000000000;79,7000000000;80,2000000000;80,2000000000;80,8000000000;80,9000000000;80,9000000000;81,0000000000;81,4000000000;81,5000000000;81,7000000000;82,2000000000;82,2000000000;82,8000000000;82,5000000000;82,3000000000;82,6000000000;82,9000000000;;
IRL;Irlande;Mortalité routière;Mortalité routière;DT_10P5HB;Décès pour 100 000 d'habitants;HSL_10;Sécurité;9,1885976870;9,5194275650;8,5408266720;7,6836657540;6,2144395960;5,2476366340;4,6489647830;4,0610608890;3,5438380370;4,0659057370;4,1221708380;3,4453739160;3,8272803070;3,2242040790;2,7941477400;2,8372588840;2,8884446570;2,6424730050;3,0036062780;3,4965154560;;
IRL;Irlande;Homicides;Homicides;DT_10P5HB;Décès pour 100 000 d'habitants;HSL_10;Sécurité;0,6000000000;0,9000000000;0,9000000000;1,0000000000;0,9000000000;1,0000000000;0,8000000000;0,6000000000;0,8000000000;0,6000000000;0,7000000000;0,5000000000;0,5000000000;0,4000000000;0,5000000000;0,3000000000;0,2000000000;0,1000000000;0,1000000000;;;
IRL;Irlande;Revenu disponible des ménages inférieur au seuil de pauvreté monétaire relative;Revenu disponible des ménages inférieur au seuil de pauvreté monétaire relative;PT_POP;Pourcentage de la population;HSL_1;Revenu et patrimoine;13,3696151081;11,5853962281;11,3874248685;9,6421806067;9,0625619017;8,8181346330;9,0931558015;9,9956138439;9,3667272955;9,5183491216;9,2602344845;9,8206201425;9,1404381800;8,9504084693;7,3983516000;8,1110448201;7,6832813251;9,6696829724;6,9967748831;;;
