Cde_Transaction;Transaction;Cde_Pays;Pays;Cde_Devise;Devise;2002;2003;2004;2005;2006;2007;2008;2009;2010;2011;2012;2013;2014;2015;2016;2017;2018;2019;2020;2021;2022;2023;2024
D995;Transferts en capital des administrations publiques vers les secteurs concernés correspondant à des impôts et contributions sociales notifiés mais non susceptible d'être perçus;AUT;Autriche;EUR;Euro;0,00;0,00;0,00;0,00;0,00;0,00;0,00;0,00;0,00;0,00;0,00;0,00;0,00;0,00;0,00;0,00;0,00;0,00;0,00;0,00;0,00;0,00;0,00
D51D;Taxes sur les gains des loteries et des paris;AUT;Autriche;EUR;Euro;0,00;0,00;0,00;0,00;0,00;0,00;0,00;0,00;0,00;0,00;0,00;0,00;0,00;0,00;0,00;0,00;0,00;0,00;0,00;0,00;0,00;0,00;0,00
D2122F;Bénéfices des monopoles sur l'importation;AUT;Autriche;EUR;Euro;0,00;0,00;0,00;0,00;0,00;0,00;0,00;0,00;0,00;0,00;0,00;0,00;0,00;0,00;0,00;0,00;0,00;0,00;0,00;0,00;0,00;0,00;0,00
D995FS;Cotisations sociales effectives à la charge des travailleurs indépendants dues non recouvrables;AUT;Autriche;EUR;Euro;0,00;0,00;0,00;0,00;0,00;0,00;0,00;0,00;0,00;0,00;0,00;0,00;0,00;0,00;0,00;0,00;0,00;0,00;0,00;0,00;0,00;0,00;0,00
D59A;Impôts courants sur le capital;AUT;Autriche;EUR;Euro;0,00;0,00;0,00;0,00;0,00;0,00;0,00;0,00;0,00;0,00;0,00;0,00;0,00;0,00;0,00;0,00;0,00;0,00;22,88;22,95;22,85;23,61;32,51
D995G;Impôts en capital dus non recouvrables;AUT;Autriche;EUR;Euro;0,00;0,00;0,00;0,00;0,00;0,00;0,00;0,00;0,00;0,00;0,00;0,00;0,00;0,00;0,00;0,00;0,00;0,00;0,00;0,00;0,00;0,00;0,00
D995D;Autres impôts courants dus non recouvrables;AUT;Autriche;EUR;Euro;0,00;0,00;0,00;0,00;0,00;0,00;0,00;0,00;0,00;0,00;0,00;0,00;0,00;0,00;0,00;0,00;0,00;0,00;0,00;0,00;0,00;0,00;0,00
D59E;Impôts sur les transactions internationales;AUT;Autriche;EUR;Euro;0,00;0,00;0,00;0,00;0,00;0,00;0,00;0,00;0,00;0,00;0,00;0,00;0,00;0,00;0,00;0,00;0,00;0,00;0,00;0,00;0,00;0,00;0,00
D51C1;Impôts sur les gains de détention des personnes physiques ou des ménages;AUT;Autriche;EUR;Euro;0,00;0,00;0,00;0,00;0,00;0,00;0,00;0,00;0,00;0,00;0,00;0,00;0,00;0,00;0,00;0,00;0,00;0,00;0,00;0,00;0,00;0,00;0,00
D995F;Cotisations sociales effectives à la charge des ménages dues non recouvrables;AUT;Autriche;EUR;Euro;0,00;0,00;0,00;0,00;0,00;0,00;0,00;0,00;0,00;0,00;0,00;0,00;0,00;0,00;0,00;0,00;0,00;0,00;0,00;0,00;0,00;0,00;0,00
D2122D;Impôts généraux sur les ventes;AUT;Autriche;EUR;Euro;0,00;0,00;0,00;0,00;0,00;0,00;0,00;0,00;0,00;0,00;0,00;0,00;0,00;0,00;0,00;0,00;0,00;0,00;0,00;0,00;0,00;0,00;0,00
D61SC;Rémunération du service des régimes d'assurance sociale (-);AUT;Autriche;EUR;Euro;0,00;0,00;0,00;0,00;0,00;0,00;0,00;0,00;0,00;0,00;0,00;0,00;0,00;0,00;0,00;0,00;0,00;0,00;0,00;0,00;0,00;0,00;0,00
D995FE;Cotisations sociales effectives à la charge des salariés dues non recouvrables;AUT;Autriche;EUR;Euro;0,00;0,00;0,00;0,00;0,00;0,00;0,00;0,00;0,00;0,00;0,00;0,00;0,00;0,00;0,00;0,00;0,00;0,00;0,00;0,00;0,00;0,00;0,00
D59C;Impôts sur la dépense;AUT;Autriche;EUR;Euro;0,00;0,00;0,00;0,00;0,00;0,00;0,00;0,00;0,00;0,00;0,00;0,00;0,00;0,00;0,00;0,00;0,00;0,00;0,00;0,00;0,00;0,00;0,00
D51C2;Impôts sur les gains de détention des sociétés;AUT;Autriche;EUR;Euro;0,00;0,00;0,00;0,00;0,00;0,00;0,00;0,00;0,00;0,00;0,00;0,00;0,00;0,00;0,00;0,00;0,00;0,00;0,00;0,00;0,00;0,00;0,00
D91C;Autres impôts en capital n.c.a.;AUT;Autriche;EUR;Euro;0,00;0,00;0,00;0,00;0,00;0,00;0,00;0,00;0,00;0,00;0,00;0,00;0,00;0,00;0,00;0,00;0,00;0,00;0,00;0,00;0,00;0,00;0,00
D29D;Impôts sur les transactions internationales;AUT;Autriche;EUR;Euro;0,00;0,00;0,00;0,00;0,00;0,00;0,00;0,00;0,00;0,00;0,00;0,00;0,00;0,00;0,00;0,00;0,00;0,00;0,00;0,00;0,00;0,00;0,00
D51C3;Autres impôts sur les gains de détention n.c.a.;AUT;Autriche;EUR;Euro;0,00;0,00;0,00;0,00;0,00;0,00;0,00;0,00;0,00;0,00;0,00;0,00;0,00;0,00;0,00;0,00;0,00;0,00;0,00;0,00;0,00;0,00;0,00
D995FN;Cotisations sociales effectives à la charge des personnes n'occupant pas d'emploi dues non recouvrables;AUT;Autriche;EUR;Euro;0,00;0,00;0,00;0,00;0,00;0,00;0,00;0,00;0,00;0,00;0,00;0,00;0,00;0,00;0,00;0,00;0,00;0,00;0,00;0,00;0,00;0,00;0,00
D611V;Cotisations sociales effectives volontaires des employeurs;AUT;Autriche;EUR;Euro;0,00;0,00;0,00;0,00;0,00;0,00;0,00;0,00;0,00;0,00;0,00;0,00;0,00;0,00;0,00;0,00;0,00;0,00;0,00;0,00;0,00;0,00;0,00
D6142;Suppléments de cotisations autres que de pension à la charge des ménages;AUT;Autriche;EUR;Euro;0,00;0,00;0,00;0,00;0,00;0,00;0,00;0,00;0,00;0,00;0,00;0,00;0,00;0,00;0,00;0,00;0,00;0,00;0,00;0,00;0,00;0,00;0,00
D995B;Autres impôts sur la production dus non recouvrables;AUT;Autriche;EUR;Euro;0,00;0,00;0,00;0,00;0,00;0,00;0,00;0,00;0,00;0,00;0,00;0,00;0,00;0,00;0,00;0,00;0,00;0,00;0,00;0,00;0,00;0,00;0,00
D995C;Impôts sur le revenu dus non recouvrables;AUT;Autriche;EUR;Euro;0,00;0,00;0,00;0,00;0,00;0,00;0,00;0,00;0,00;0,00;0,00;0,00;0,00;0,00;0,00;0,00;0,00;0,00;0,00;0,00;0,00;0,00;0,00
D2122B;Montants compensatoires monétaires prélevés à l'importation;AUT;Autriche;EUR;Euro;0,00;0,00;0,00;0,00;0,00;0,00;0,00;0,00;0,00;0,00;0,00;0,00;0,00;0,00;0,00;0,00;0,00;0,00;0,00;0,00;0,00;0,00;0,00
D29F;Impôts sur les émissions polluantes;AUT;Autriche;EUR;Euro;0,00;0,00;0,00;0,00;0,00;0,00;0,00;0,00;5,18;5,42;3,28;18,36;55,75;53,34;78,60;59,46;79,43;210,37;183,83;184,22;310,95;381,69;438,42
D214B;Droits de timbre;AUT;Autriche;EUR;Euro;0,00;0,00;0,00;0,00;0,00;0,00;0,00;0,00;0,00;0,00;0,00;0,00;0,00;0,00;0,00;0,00;0,00;0,00;0,00;0,00;0,00;0,00;0,00
D214K;Droits sur les exportations et montants compensatoires monétaires prélevés à l'exportation;AUT;Autriche;EUR;Euro;0,00;0,00;0,00;0,00;0,00;0,00;0,00;0,00;0,00;0,00;0,00;0,00;0,00;0,00;0,00;0,00;0,00;0,00;0,00;0,00;0,00;0,00;0,00
D2122A;Prélèvements sur les produits agricoles importés;AUT;Autriche;EUR;Euro;0,00;0,00;0,00;0,00;0,00;0,00;0,00;0,00;0,00;0,00;0,00;0,00;0,00;0,00;0,00;0,00;0,00;0,00;0,00;0,00;0,00;0,00;0,00
D214I;Impôts généraux sur les ventes ou le chiffre d'affaires;AUT;Autriche;EUR;Euro;0,00;0,00;0,00;0,00;0,00;0,00;0,00;0,00;0,00;0,00;0,00;0,00;0,00;0,00;0,00;0,00;0,00;0,00;0,00;0,00;0,00;0,00;0,00
D29B;Impôts sur l'utilisation d'actifs fixes;AUT;Autriche;EUR;Euro;0,00;0,00;0,00;0,00;0,00;0,00;0,00;0,00;0,00;0,00;0,00;0,00;0,00;0,00;0,00;0,00;0,00;0,00;0,00;0,00;0,00;0,00;0,00
D614;Suppléments de cotisations sociales à la charge des ménages;AUT;Autriche;EUR;Euro;0,00;0,00;0,00;0,00;0,00;0,00;0,00;0,00;0,00;0,00;0,00;0,00;0,00;0,00;0,00;0,00;0,00;0,00;0,00;0,00;0,00;0,00;0,00
D91B;Prélèvements sur le capital;AUT;Autriche;EUR;Euro;0,00;0,00;0,00;0,00;0,00;0,00;0,00;0,00;0,00;0,00;0,00;717,13;264,05;3,55;30,34;10,43;-0,58;0,05;-0,01;-0,05;0,00;0,00;0,00
D995A;Impôts sur les produits dus non recouvrables;AUT;Autriche;EUR;Euro;0,00;0,00;0,00;0,00;0,00;0,00;0,00;0,00;0,00;0,00;0,00;0,00;0,00;0,00;0,00;0,00;0,00;0,00;0,00;0,00;0,00;0,00;0,00
D59B;Impôts de capitation;AUT;Autriche;EUR;Euro;0,00;0,00;0,00;0,00;0,00;0,00;0,00;0,00;0,00;0,00;0,00;0,00;0,00;0,00;0,00;0,00;0,00;0,00;0,00;0,00;0,00;0,00;0,00
D29E;Autorisations d'exercer des activités commerciales ou professionnelles;AUT;Autriche;EUR;Euro;0,00;0,00;0,00;0,00;0,00;0,00;0,00;0,00;0,00;0,00;0,00;0,00;0,00;0,00;0,00;0,00;0,00;0,00;0,00;0,00;0,00;0,00;0,00
D59D;Paiements effectués par les ménages en vue de l’obtention de licences;AUT;Autriche;EUR;Euro;0,00;0,00;0,00;0,00;0,00;0,00;0,00;0,00;0,00;0,00;0,00;0,00;0,00;0,00;0,00;0,00;0,00;0,00;0,00;0,00;0,00;0,00;0,00
D214J;Bénéfices des monopoles fiscaux;AUT;Autriche;EUR;Euro;0,00;0,00;0,00;0,00;0,00;0,00;0,00;0,00;0,00;186,06;203,71;194,37;197,60;207,61;248,01;242,28;248,13;246,48;242,32;297,54;254,39;283,84;272,84
D6141;Suppléments de cotisations de pension à la charge des ménages;AUT;Autriche;EUR;Euro;0,00;0,00;0,00;0,00;0,00;0,00;0,00;0,00;0,00;0,00;0,00;0,00;0,00;0,00;0,00;0,00;0,00;0,00;0,00;0,00;0,00;0,00;0,00
D995E;Cotisations sociales effectives à la charge des employeurs dues non recouvrables;AUT;Autriche;EUR;Euro;0,00;0,00;0,00;0,00;0,00;0,00;0,00;0,00;0,00;0,00;0,00;0,00;0,00;0,00;0,00;0,00;0,00;0,00;0,00;0,00;0,00;0,00;0,00
D51C;Impôts sur les gains de détention;AUT;Autriche;EUR;Euro;0,00;0,00;0,00;0,00;0,00;0,00;0,00;0,00;0,00;0,00;0,00;0,00;0,00;0,00;0,00;0,00;0,00;0,00;0,00;0,00;0,00;0,00;0,00
D2122C;Droits d'accise;AUT;Autriche;EUR;Euro;0,00;0,00;0,00;0,00;0,00;0,00;0,00;0,00;0,00;0,00;0,00;0,00;0,00;0,00;0,00;0,00;0,00;0,00;0,00;0,00;0,00;0,00;0,00
D613CSN;Cotisations sociales obligatoires à la charge des travailleurs indépendants et des personnes n'occupant pas d'emploi;AUT;Autriche;EUR;Euro;3957,75;4120,69;4535,82;4657,50;4908,38;5040,86;5254,59;5548,66;5495,92;5858,78;6116,48;6388,46;6649,98;6897,07;7079,42;7373,91;7636,09;7978,30;8020,49;8630,67;8771,64;9266,67;10039,73
D29A;Impôts sur les terrains, bâtiments et autres constructions;AUT;Autriche;EUR;Euro;555,85;577,46;589,12;606,64;613,64;625,96;651,05;667,34;681,94;693,49;708,88;735,78;748,57;761,25;771,18;805,16;806,81;829,03;838,60;865,79;873,59;905,44;914,06
D21;Impôts sur les produits;AUT;Autriche;EUR;Euro;26256,92;26624,46;27628,86;28382,16;29028,85;30751,52;31670,71;31796,26;32731,09;34177,45;35778,92;36107,38;36850,07;38275,71;39828,73;41012,74;42036,54;43143,74;40071,78;44013,58;47630,84;50326,01;52066,61
D214D;Taxes à l'immatriculation des véhicules;AUT;Autriche;EUR;Euro;136,98;144,46;147,63;151,50;150,59;148,46;149,97;153,27;158,40;168,22;177,49;175,20;173,48;173,61;181,75;188,49;191,16;188,13;175,13;188,98;161,03;164,51;174,22
D29G;Sous-compensation de la TVA (régime forfaitaire);AUT;Autriche;EUR;Euro;38,15;32,72;32,34;53,18;22,60;4,02;53,07;93,50;35,45;25,69;34,81;44,30;35,79;46,81;-14,61;4,27;36,33;38,08;62,10;162,75;82,83;64,10;0,00
D2122E;Impôts sur des services déterminés;AUT;Autriche;EUR;Euro;22,92;22,54;0,90;0,26;0,12;0,06;0,03;0,01;0,01;0,00;0,00;0,00;0,00;0,00;0,00;0,00;0,00;0,00;0,00;0,00;0,00;0,00;0,00
D91;Impôts en capital;AUT;Autriche;EUR;Euro;148,08;157,01;154,38;139,66;131,89;155,17;142,67;129,78;44,84;50,83;31,67;747,29;295,68;87,79;54,85;27,28;83,45;10,87;13,88;12,96;42,83;90,66;29,95
D51M;Impôts sur le revenu des personnes physiques ou des ménages y compris les gains de détention;AUT;Autriche;EUR;Euro;23314,40;23579,49;23960,52;23946,90;25211,59;27328,06;29790,89;27712,47;28158,01;29481,16;31232,34;32425,49;34260,01;36664,76;32857,22;34046,80;36694,49;38537,58;35827,54;40017,62;43617,27;45150,16;48976,12
D5;Impôts courants sur le revenu, le patrimoine, etc.;AUT;Autriche;EUR;Euro;30963,81;31239,40;32131,93;32372,99;33935,10;37298,58;40284,80;35916,86;37145,15;39188,98;41274,06;43146,03;45361,61;48489,49;45485,54;47667,03;51754,30;53993,62;48668,12;56128,89;64102,04;66045,44;69391,71
D613CN;Cotisations sociales effectives obligatoires à la charge des personnes n'occupant pas d'emploi;AUT;Autriche;EUR;Euro;2395,63;2442,33;2190,51;2262,47;2359,78;2417,75;2574,16;2735,97;2839,87;2920,23;3059,26;3163,85;3257,99;3322,17;3400,95;3478,04;3554,75;3658,90;3888,25;3999,06;4090,64;4402,50;4894,90
D613V;Cotisations sociales effectives volontaires des ménages;AUT;Autriche;EUR;Euro;213,54;210,18;227,15;246,95;272,94;256,40;269,77;299,21;338,28;341,82;308,81;298,06;310,46;320,13;319,93;317,12;321,05;335,60;343,89;358,15;372,53;366,00;392,22
ODC;Produit total des impôts et cotisations sociales nettes (y compris cotisations sociales imputées), après déduction des montants dus non recouvrables;AUT;Autriche;EUR;Euro;99726,29;101291,07;104613,68;106738,33;110679,67;117735,34;124061,64;120639,24;123873,14;130038,07;135671,24;140811,86;145062,42;151240,78;152016,19;157052,88;165102,97;171341,96;162613,85;178110,41;194071,73;204822,23;215870,45
D29H;Autres impôts sur la production n.c.a.;AUT;Autriche;EUR;Euro;1307,65;1268,66;1252,14;1211,31;1222,61;1210,66;1205,38;1292,60;1472,42;1876,52;1923,98;1927,48;1885,13;1826,01;1966,93;1810,10;1798,34;1889,62;1937,99;1869,48;1862,48;2298,02;1875,96
D51E;Autres impôts sur le revenu n.c.a.;AUT;Autriche;EUR;Euro;637,20;642,02;657,92;682,42;716,46;753,22;785,47;797,18;811,61;844,65;877,21;915,26;935,69;965,46;1003,56;1068,18;1125,57;1157,63;1148,60;1229,28;1301,49;1398,14;1504,38
D51O;Impôts sur le revenu des sociétés y compris les gains de détention;AUT;Autriche;EUR;Euro;5246,72;5200,24;5607,00;5766,12;5963,71;7069,37;7467,54;5113,86;5810,43;6470,01;6679,43;7240,44;7273,00;7941,39;8632,72;9362,68;10695,73;10981,57;8380,20;11487,06;15664,68;15920,89;15433,79
D612;Cotisations sociales imputées à la charge des employeurs;AUT;Autriche;EUR;Euro;2626,15;2635,33;2641,95;2249,35;2189,50;2177,44;2160,14;2129,39;2106,36;2071,10;2024,82;1972,12;1912,96;1924,87;1865,23;1806,86;1757,07;1703,36;1639,91;1566,78;1525,70;1528,36;1568,83
D29;Autres impôts sur la production;AUT;Autriche;EUR;Euro;7401,91;7495,78;7595,03;7763,27;8013,51;8352,16;9046,53;9400,51;9743,24;10513,07;10951,24;11300,20;11569,04;11762,87;12199,79;11855,70;12011,67;12585,17;12321,33;13201,07;13959,05;15091,30;15407,11
D51A;Impôts sur le revenu des personnes physiques ou des ménages non compris les gains de détention;AUT;Autriche;EUR;Euro;23314,40;23579,49;23960,52;23946,90;25211,59;27328,06;29790,89;27712,47;28158,01;29481,16;31232,34;32425,49;34260,01;36664,76;32857,22;34046,80;36694,49;38537,58;35827,54;40017,62;43617,27;45150,16;48976,12
D2;Impôts sur la production et les importations;AUT;Autriche;EUR;Euro;33658,83;34120,24;35223,89;36145,42;37042,36;39103,67;40717,24;41196,77;42474,33;44690,52;46730,16;47407,58;48419,11;50038,58;52028,52;52868,43;54048,22;55728,91;52393,11;57214,65;61589,90;65417,31;67473,72
D613CE;Cotisations sociales effectives obligatoires à la charge des salariés;AUT;Autriche;EUR;Euro;13125,45;13421,23;13838,84;14364,01;14938,89;15612,00;16377,64;16471,28;16846,77;17533,93;18103,04;18930,36;19445,31;20104,35;20907,85;21706,95;22792,87;23764,94;23825,23;25013,86;26587,07;28666,22;30891,54
D2121;Droits sur les importations;AUT;Autriche;EUR;Euro;-1,47;-1,30;3,94;1,43;0,07;-7,66;-20,65;0,07;0,09;0,08;0,07;0,00;0,00;0,00;0,00;0,00;0,00;0,00;0,00;0,00;0,00;0,00;0,00
D214L;Autres impôts sur les produits n.c.a.;AUT;Autriche;EUR;Euro;3,74;5,67;6,13;6,88;6,89;10,60;6,98;6,06;6,39;7,17;7,71;7,10;4,44;13,26;7,51;6,99;7,07;7,12;7,82;8,61;12,88;8,06;143,63
D59F;Autres impôts courants n.c.a.;AUT;Autriche;EUR;Euro;1765,49;1817,65;1906,49;1977,56;2043,35;2147,92;2240,89;2293,36;2365,11;2393,16;2485,07;2564,84;2892,92;2917,88;2992,05;3189,37;3238,51;3316,84;3288,90;3371,97;3495,76;3552,64;3444,91
D2122;Impôts sur les importations à l'exclusion de la TVA et des droits sur les importations;AUT;Autriche;EUR;Euro;22,92;22,54;0,90;0,26;0,12;0,06;0,03;0,01;0,01;0,00;0,00;0,00;0,00;0,00;0,00;0,00;0,00;0,00;0,00;0,00;0,00;0,00;0,00
D613CS;Cotisations sociales effectives obligatoires à la charge des travailleurs indépendants;AUT;Autriche;EUR;Euro;1562,12;1678,36;2345,31;2395,03;2548,60;2623,11;2680,43;2812,69;2656,05;2938,55;3057,22;3224,61;3391,99;3574,90;3678,47;3895,87;4081,34;4319,40;4132,24;4631,61;4681,00;4864,17;5144,83
D61;Cotisations sociales nettes;AUT;Autriche;EUR;Euro;34955,57;35774,42;37103,47;38080,26;39570,31;41177,92;42916,93;43395,83;44208,82;46107,74;47635,35;49510,96;50986,02;52624,91;54447,28;56490,14;59217,00;61608,56;61538,75;64753,90;68336,97;73268,82;78975,07
D212;Impôts et droits sur les importations, à l'exclusion de la TVA;AUT;Autriche;EUR;Euro;21,46;21,24;4,83;1,68;0,19;-7,60;-20,62;0,08;0,10;0,08;0,07;0,00;0,00;0,00;0,00;0,00;0,00;0,00;0,00;0,00;0,00;0,00;0,00
D214G;Taxes sur les primes d'assurance;AUT;Autriche;EUR;Euro;874,34;939,49;1008,05;1007,87;1031,09;1047,12;1078,34;1089,99;1073,51;1128,76;1109,90;1113,18;1160,98;1183,37;1208,38;1190,35;1242,21;1281,77;1307,43;1356,95;1441,73;1549,72;1649,24
D613C;Cotisations sociales effectives obligatoires à la charge des ménages;AUT;Autriche;EUR;Euro;17083,20;17541,92;18374,66;19021,51;19847,28;20652,86;21632,23;22019,93;22342,70;23392,71;24219,52;25318,82;26095,29;27001,42;27987,26;29080,86;30428,95;31743,24;31845,73;33644,53;35358,70;37932,90;40931,27
D613;Cotisations sociales effectives à la charge des ménages;AUT;Autriche;EUR;Euro;17296,74;17752,10;18601,81;19268,47;20120,22;20909,27;21902,00;22319,14;22680,98;23734,53;24528,33;25616,88;26405,75;27321,55;28307,19;29397,97;30750,00;32078,84;32189,62;34002,67;35731,23;38298,90;41323,50
D214H;Autres taxes sur des services déterminés;AUT;Autriche;EUR;Euro;315,34;334,46;297,77;319,41;378,09;378,96;392,70;377,40;363,05;394,89;450,40;443,88;451,23;458,07;494,34;521,12;498,23;508,78;446,65;545,12;635,72;715,49;791,54
D211;Taxes du type TVA;AUT;Autriche;EUR;Euro;17934,47;17870,87;18553,08;19367,74;19687,72;20936,81;21853,87;22085,17;22675,01;23418,65;24509,40;24875,39;25372,33;26234,87;27322,14;28307,68;29287,31;30387,45;28168,73;30621,50;35496,47;37891,13;39259,11
D611;Cotisations sociales effectives à la charge des employeurs;AUT;Autriche;EUR;Euro;15032,69;15386,99;15859,71;16562,44;17260,59;18091,21;18854,80;18947,29;19421,48;20302,11;21082,21;21921,96;22667,30;23378,50;24274,85;25285,31;26709,93;27826,35;27709,22;29184,45;31080,04;33441,57;36082,74
D51;Impôts sur le revenu;AUT;Autriche;EUR;Euro;29198,32;29421,75;30225,44;30395,44;31891,76;35150,65;38043,90;33623,51;34780,04;36795,82;38788,99;40581,19;42468,70;45571,61;42493,49;44477,66;48515,78;50676,78;45356,34;52733,96;60583,43;62469,19;65914,29
D214A;Droits d'accise et impôts de consommation;AUT;Autriche;EUR;Euro;5904,01;6236,45;6497,08;6486,92;6475,14;6905,13;6901,11;6778,59;7057,74;7600,22;7888,10;8039,82;8154,03;8516,66;8868,60;9077,39;8939,04;8801,18;8038,37;8967,84;7517,61;8083,54;8169,90
D51B;Impôts sur le revenu ou les bénéfices des sociétés non compris les gains de détention;AUT;Autriche;EUR;Euro;5246,72;5200,24;5607,00;5766,12;5963,71;7069,37;7467,54;5113,86;5810,43;6470,01;6679,43;7240,44;7273,00;7941,39;8632,72;9362,68;10695,73;10981,57;8380,20;11487,06;15664,68;15920,89;15433,79
ODA;Total des recettes fiscales;AUT;Autriche;EUR;Euro;64770,72;65516,65;67510,20;68658,07;71109,35;76557,42;81144,71;77243,41;79664,33;83930,32;88035,88;91300,89;94076,41;98615,86;97568,91;100562,75;105885,97;109733,40;101075,10;113356,51;125734,77;131553,41;136895,38
D214C;Impôts sur les opérations financières et les opérations en capital;AUT;Autriche;EUR;Euro;501,93;528,42;565,66;629,20;764,09;790,78;740,57;713,96;828,10;831,46;1024,70;857,67;945,34;1116,06;1126,53;1109,98;1210,07;1317,81;1320,03;1656,59;1693,92;1177,42;1116,03
D214;Impôts sur les produits à l'exclusion de TVA et des impôts sur les importations et les exportations;AUT;Autriche;EUR;Euro;8300,99;8732,35;9070,95;9012,74;9340,94;9822,30;9837,46;9711,01;10055,98;10758,71;11269,45;11231,99;11477,74;12040,84;12506,59;12705,06;12749,23;12756,29;11903,05;13392,08;12134,38;12434,88;12807,50
ODD;Charges fiscales correspondant au produit total des impôts et cotisations sociales obligatoires après déduction des montants dus non recouvrables;AUT;Autriche;EUR;Euro;96886,60;98445,56;101744,57;104242,03;108217,22;115301,50;121631,73;118210,64;121428,50;127625,14;133337,61;138541,67;142839,00;148995,78;149831,03;154928,91;163024,85;169302,99;160630,05;176185,48;192173,51;202927,87;213909,40
D29C;Impôts sur la masse salariale ou les effectifs employés;AUT;Autriche;EUR;Euro;5500,27;5616,93;5721,43;5892,12;6154,66;6511,51;7137,03;7347,07;7548,25;7911,96;8280,29;8574,29;8843,80;9075,46;9397,70;9176,72;9290,77;9618,07;9298,81;10118,84;10829,20;11442,04;12178,68
D61N;Cotisations sociales effectives des employeurs et des ménages;AUT;Autriche;EUR;Euro;32329,43;33139,09;34461,52;35830,91;37380,81;39000,48;40756,80;41266,43;42102,46;44036,64;45610,54;47538,84;49073,05;50700,05;52582,04;54683,28;57459,93;59905,19;59898,84;63187,12;66811,27;71740,47;77406,24
D91A;Impôts sur les transferts en capital;AUT;Autriche;EUR;Euro;148,08;157,01;154,38;139,66;131,89;155,17;142,67;129,78;44,84;50,83;31,67;30,16;31,63;84,24;24,51;16,85;84,03;10,82;13,89;13,01;42,83;90,66;29,95
D2_D5_D91_D611_D613;Total des impôts et des cotisations sociales;AUT;Autriche;EUR;Euro;97100,15;98655,74;101971,72;104488,98;108490,16;115557,90;121901,51;118509,84;121766,79;127966,96;133646,42;138839,73;143149,46;149315,91;150150,95;155246,03;163345,90;169638,59;160973,94;176543,63;192546,04;203293,88;214301,62
D59;Autres impôts courants;AUT;Autriche;EUR;Euro;1765,49;1817,65;1906,49;1977,56;2043,35;2147,92;2240,89;2293,36;2365,11;2393,16;2485,07;2564,84;2892,92;2917,88;2992,05;3189,37;3238,51;3316,84;3311,78;3394,93;3518,61;3576,25;3477,42
D611C;Cotisations sociales effectives obligatoires à la charge des employeurs;AUT;Autriche;EUR;Euro;15032,69;15386,99;15859,71;16562,44;17260,59;18091,21;18854,80;18947,29;19421,48;20302,11;21082,21;21921,96;22667,30;23378,50;24274,85;25285,31;26709,93;27826,35;27709,22;29184,45;31080,04;33441,57;36082,74
D214E;Taxes sur les spectacles et divertissements;AUT;Autriche;EUR;Euro;77,33;78,72;79,60;85,31;96,64;102,04;105,50;110,16;116,27;110,43;103,79;104,61;99,11;47,90;29,07;19,11;17,22;18,25;9,41;7,58;13,91;15,32;16,62
D214F;Taxes sur les loteries, les jeux et les paris;AUT;Autriche;EUR;Euro;487,32;464,67;469,03;325,65;438,40;439,23;462,29;481,59;452,52;331,50;303,65;296,16;291,54;324,31;342,41;349,35;396,09;386,75;355,89;362,88;403,20;436,98;473,49
D29G;Sous-compensation de la TVA (régime forfaitaire);BEL;Belgique;EUR;Euro;0,00;0,00;0,00;0,00;0,00;0,00;0,00;0,00;0,00;0,00;0,00;0,00;0,00;0,00;0,00;0,00;0,00;0,00;0,00;0,00;0,00;0,00;0,00
D2122D;Impôts généraux sur les ventes;BEL;Belgique;EUR;Euro;0,00;0,00;0,00;0,00;0,00;0,00;0,00;0,00;0,00;0,00;0,00;0,00;0,00;0,00;0,00;0,00;0,00;0,00;0,00;0,00;0,00;0,00;0,00
D611V;Cotisations sociales effectives volontaires des employeurs;BEL;Belgique;EUR;Euro;0,00;0,00;0,00;0,00;0,00;0,00;0,00;0,00;0,00;0,00;0,00;0,00;0,00;0,00;0,00;0,00;0,00;0,00;0,00;0,00;0,00;0,00;0,00
D59C;Impôts sur la dépense;BEL;Belgique;EUR;Euro;0,00;0,00;0,00;0,00;0,00;0,00;0,00;0,00;0,00;0,00;0,00;0,00;0,00;0,00;0,00;0,00;0,00;0,00;0,00;0,00;0,00;0,00;0,00
D2122B;Montants compensatoires monétaires prélevés à l'importation;BEL;Belgique;EUR;Euro;0,00;0,00;0,00;0,00;0,00;0,00;0,00;0,00;0,00;0,00;0,00;0,00;0,00;0,00;0,00;0,00;0,00;0,00;0,00;0,00;0,00;0,00;0,00
D51D;Taxes sur les gains des loteries et des paris;BEL;Belgique;EUR;Euro;0,00;0,00;0,00;0,00;0,00;0,00;0,00;0,00;0,00;0,00;0,00;0,00;0,00;0,00;0,00;0,00;0,00;0,00;0,00;0,00;0,00;0,00;0,00
D2122F;Bénéfices des monopoles sur l'importation;BEL;Belgique;EUR;Euro;0,00;0,00;0,00;0,00;0,00;0,00;0,00;0,00;0,00;0,00;0,00;0,00;0,00;0,00;0,00;0,00;0,00;0,00;0,00;0,00;0,00;0,00;0,00
D59E;Impôts sur les transactions internationales;BEL;Belgique;EUR;Euro;0,00;0,00;0,00;0,00;0,00;0,00;0,00;0,00;0,00;0,00;0,00;0,00;0,00;0,00;0,00;0,00;0,00;0,00;0,00;0,00;0,00;0,00;0,00
D214K;Droits sur les exportations et montants compensatoires monétaires prélevés à l'exportation;BEL;Belgique;EUR;Euro;0,00;0,00;0,00;0,00;0,00;0,00;0,00;0,00;0,00;0,00;0,00;0,00;0,00;0,00;0,00;0,00;0,00;0,00;0,00;0,00;0,00;0,00;0,00
D29D;Impôts sur les transactions internationales;BEL;Belgique;EUR;Euro;0,00;0,00;0,00;0,00;0,00;0,00;0,00;0,00;0,00;0,00;0,00;0,00;0,00;0,00;0,00;0,00;0,00;0,00;0,00;0,00;0,00;0,00;0,00
D214E;Taxes sur les spectacles et divertissements;BEL;Belgique;EUR;Euro;0,00;0,00;0,00;0,00;0,00;0,00;0,00;0,00;0,00;0,00;0,00;0,00;0,00;0,00;0,00;0,00;0,00;0,00;0,00;0,00;0,00;0,00;0,00
D91C;Autres impôts en capital n.c.a.;BEL;Belgique;EUR;Euro;0,00;0,00;0,00;0,00;0,00;0,00;0,00;0,00;0,00;0,00;0,00;0,00;0,00;0,00;0,00;0,00;0,00;0,00;0,00;0,00;0,00;0,00;0,00
D2122E;Impôts sur des services déterminés;BEL;Belgique;EUR;Euro;0,00;0,00;0,00;0,00;0,00;0,00;0,00;0,00;0,00;0,00;0,00;0,00;0,00;0,00;0,00;0,00;0,00;0,00;0,00;0,00;0,00;0,00;0,00
D214H;Autres taxes sur des services déterminés;BEL;Belgique;EUR;Euro;0,00;0,00;0,00;0,00;0,00;0,00;0,00;0,00;0,00;0,00;0,00;0,00;0,00;0,00;0,00;0,00;0,00;0,00;0,00;0,00;20,50;40,30;42,30
D214I;Impôts généraux sur les ventes ou le chiffre d'affaires;BEL;Belgique;EUR;Euro;0,00;0,00;0,00;0,00;0,00;0,00;0,00;0,00;0,00;0,00;0,00;0,00;0,00;0,00;0,00;0,00;0,00;0,00;0,00;0,00;0,00;0,00;0,00
D2121;Droits sur les importations;BEL;Belgique;EUR;Euro;0,00;0,00;0,00;0,00;0,00;0,00;0,00;0,00;0,00;0,00;0,00;0,00;0,00;0,00;0,00;0,00;0,00;0,00;0,00;0,00;0,00;0,00;0,00
D2122A;Prélèvements sur les produits agricoles importés;BEL;Belgique;EUR;Euro;0,00;0,00;0,00;0,00;0,00;0,00;0,00;0,00;0,00;0,00;0,00;0,00;0,00;0,00;0,00;0,00;0,00;0,00;0,00;0,00;0,00;0,00;0,00
D613CSN;Cotisations sociales obligatoires à la charge des travailleurs indépendants et des personnes n'occupant pas d'emploi;BEL;Belgique;EUR;Euro;3161,80;3250,10;3413,10;3536,70;3722,90;3865,60;4349,80;4571,50;4637,40;4708,70;4928,70;5135,80;5226,00;5537,20;5753,20;5921,30;6102,00;6230,00;6104,10;6327,70;6737,50;7312,20;7460,40
D214C;Impôts sur les opérations financières et les opérations en capital;BEL;Belgique;EUR;Euro;2377,10;2541,40;2714,30;3129,20;3476,40;3701,10;3544,90;3095,90;3493,00;3771,20;3781,80;3886,10;4081,00;4358,20;4463,70;4800,30;4899,30;5378,70;4960,90;5942,70;5616,50;4999,30;5488,20
D91;Impôts en capital;BEL;Belgique;EUR;Euro;1255,90;1390,40;2176,60;1872,80;2153,30;2215,70;2370,10;2234,70;2596,30;2771,70;3318,00;3973,00;3898,20;3638,80;3346,50;3616,50;3772,00;3391,10;3287,60;4079,00;3902,30;3958,60;4257,70
D29C;Impôts sur la masse salariale ou les effectifs employés;BEL;Belgique;EUR;Euro;22,30;22,00;21,50;19,70;12,40;9,60;7,30;5,20;2,30;-0,30;0,00;0,00;0,00;0,00;0,00;0,00;0,00;0,00;0,00;0,00;0,00;0,00;0,00
D29H;Autres impôts sur la production n.c.a.;BEL;Belgique;EUR;Euro;768,70;887,60;963,80;919,90;1146,20;1071,30;1417,30;1681,70;1815,60;1557,10;2536,30;2546,00;2782,80;2641,30;2864,00;2755,60;2858,70;2896,90;2792,00;2801,40;3429,10;4982,30;3375,40
