D2122A;Prélèvements sur les produits agricoles importés;GRC;Grèce;EUR;Euro;0,00;0,00;0,00;0,00;0,00;0,00;0,00;0,00;0,00;0,00;0,00;0,00;0,00;0,00;0,00;0,00;0,00;0,00;0,00;0,00;0,00;0,00;0,00
D51C3;Autres impôts sur les gains de détention n.c.a.;GRC;Grèce;EUR;Euro;0,00;0,00;0,00;0,00;0,00;0,00;0,00;0,00;0,00;0,00;0,00;0,00;0,00;0,00;0,00;0,00;0,00;0,00;0,00;0,00;0,00;0,00;0,00
D613CS;Cotisations sociales effectives obligatoires à la charge des travailleurs indépendants;GRC;Grèce;EUR;Euro;0,00;0,00;0,00;0,00;0,00;0,00;0,00;0,00;0,00;0,00;0,00;0,00;0,00;0,00;0,00;0,00;0,00;0,00;0,00;0,00;0,00;0,00;0,00
D995F;Cotisations sociales effectives à la charge des ménages dues non recouvrables;GRC;Grèce;EUR;Euro;0,00;0,00;0,00;0,00;0,00;0,00;0,00;0,00;0,00;0,00;0,00;0,00;0,00;0,00;0,00;0,00;0,00;0,00;0,00;0,00;0,00;0,00;0,00
D6141;Suppléments de cotisations de pension à la charge des ménages;GRC;Grèce;EUR;Euro;0,00;0,00;0,00;0,00;0,00;0,00;0,00;0,00;0,00;0,00;0,00;0,00;0,00;0,00;0,00;0,00;0,00;0,00;0,00;0,00;0,00;0,00;0,00
D995D;Autres impôts courants dus non recouvrables;GRC;Grèce;EUR;Euro;0,00;0,00;0,00;0,00;0,00;0,00;0,00;0,00;0,00;0,00;0,00;0,00;0,00;0,00;0,00;0,00;0,00;0,00;0,00;0,00;0,00;0,00;0,00
D2122E;Impôts sur des services déterminés;GRC;Grèce;EUR;Euro;0,00;0,00;0,00;0,00;0,00;0,00;0,00;0,00;0,00;0,00;0,00;0,00;0,00;0,00;0,00;0,00;0,00;0,00;0,00;0,00;0,00;0,00;0,00
D214J;Bénéfices des monopoles fiscaux;GRC;Grèce;EUR;Euro;0,00;0,00;0,00;0,00;0,00;0,00;0,00;0,00;0,00;0,00;0,00;0,00;0,00;0,00;0,00;0,00;0,00;0,00;0,00;0,00;0,00;0,00;0,00
D59E;Impôts sur les transactions internationales;GRC;Grèce;EUR;Euro;0,00;0,00;0,00;0,00;0,00;0,00;0,00;0,00;0,00;0,00;0,00;0,00;0,00;0,00;0,00;0,00;0,00;0,00;0,00;0,00;0,00;0,00;0,00
D6122;Cotisations imputées autres que de pension à la charge des employeurs;GRC;Grèce;EUR;Euro;0,00;0,00;0,00;0,00;0,00;0,00;0,00;0,00;0,00;0,00;0,00;0,00;0,00;0,00;0,00;0,00;0,00;0,00;0,00;0,00;0,00;0,00;0,00
D51C2;Impôts sur les gains de détention des sociétés;GRC;Grèce;EUR;Euro;0,00;0,00;0,00;0,00;0,00;0,00;0,00;0,00;0,00;0,00;0,00;0,00;0,00;0,00;0,00;0,00;0,00;0,00;0,00;0,00;0,00;0,00;0,00
ODA;Total des recettes fiscales;GRC;Grèce;EUR;Euro;35858,00;36447,00;38386,00;41904,00;45022,00;48743,00;50667,00;48642,00;47386,00;47323,00;48044,00;45711,00;46284,00;46080,00;48811,00;49134,00;50669,00;49764,00;43452,00;48362,00;58923,00;61491,00;66859,00
D613C;Cotisations sociales effectives obligatoires à la charge des ménages;GRC;Grèce;EUR;Euro;9544,00;10513,00;11012,00;11237,00;12177,00;13417,00;13774,00;13101,00;13292,00;12210,00;11662,00;10881,00;10590,00;11095,00;11597,00;12217,00;11874,00;12063,00;11622,00;12215,00;13619,00;13473,00;14586,00
D61;Cotisations sociales nettes;GRC;Grèce;EUR;Euro;20520,00;22301,00;23440,00;24537,00;25891,00;28892,00;30641,00;29344,00;29700,00;27272,00;26621,00;24455,00;24088,00;24422,00;24908,00;25998,00;26272,00;26654,00;25438,00;27273,00;29041,00;29219,00;31519,00
D51D;Taxes sur les gains des loteries et des paris;GRC;Grèce;EUR;Euro;39,00;26,00;30,00;47,00;48,00;54,00;58,00;59,00;67,00;65,00;72,00;82,00;78,00;108,00;84,00;79,00;123,00;146,00;88,00;128,00;117,00;210,00;346,00
D6131;Cotisations de pension effectives à la charge des ménages;GRC;Grèce;EUR;Euro;6963,00;7585,00;8022,00;8103,00;9002,00;9899,00;10152,00;9797,00;9834,00;8920,00;8403,00;7938,00;7513,00;7860,00;8203,00;7857,00;7743,00;8038,00;7521,00;8387,00;9073,00;9239,00;10131,00
D613;Cotisations sociales effectives à la charge des ménages;GRC;Grèce;EUR;Euro;9544,00;10513,00;11012,00;11237,00;12177,00;13417,00;13774,00;13101,00;13292,00;12210,00;11662,00;10881,00;10590,00;11095,00;11597,00;12217,00;11874,00;12063,00;11622,00;12215,00;13619,00;13473,00;14586,00
D91B;Prélèvements sur le capital;GRC;Grèce;EUR;Euro;37,00;41,00;47,00;63,00;66,00;95,00;90,00;77,00;84,00;68,00;43,00;46,00;25,00;30,00;20,00;25,00;24,00;24,00;21,00;31,00;29,00;33,00;32,00
D2122C;Droits d'accise;GRC;Grèce;EUR;Euro;63,00;57,00;52,00;72,00;154,00;147,00;358,00;345,00;249,00;282,00;153,00;175,00;103,00;205,00;190,00;347,00;313,00;374,00;337,00;393,00;353,00;296,00;340,00
D214D;Taxes à l'immatriculation des véhicules;GRC;Grèce;EUR;Euro;775,00;847,00;935,00;909,00;924,00;1023,00;826,00;522,00;269,00;152,00;99,00;112,00;169,00;201,00;227,00;261,00;268,00;298,00;237,00;293,00;380,00;479,00;446,00
D51O;Impôts sur le revenu des sociétés y compris les gains de détention;GRC;Grèce;EUR;Euro;5355,00;4882,00;5259,00;6487,00;5552,00;5304,00;5188,00;5961,00;5717,00;4283,00;2088,00;2071,00;3349,00;3800,00;4388,00;3510,00;3998,00;3482,00;2350,00;3163,00;4628,00;6087,00;7111,00
D29;Autres impôts sur la production;GRC;Grèce;EUR;Euro;941,00;1019,00;1071,00;1142,00;1389,00;1428,00;2080,00;2406,00;1814,00;2363,00;3360,00;3830,00;6011,00;6533,00;6506,00;6645,00;6040,00;5949,00;5511,00;6207,00;6484,00;6571,00;6592,00
D612;Cotisations sociales imputées à la charge des employeurs;GRC;Grèce;EUR;Euro;2392,00;2613,00;3071,00;3201,00;3541,00;3952,00;4655,00;5194,00;4952,00;5134,00;5689,00;5101,00;5513,00;5615,00;5595,00;5220,00;4826,00;4394,00;4086,00;3856,00;3855,00;3974,00;3931,00
D214A;Droits d'accise et impôts de consommation;GRC;Grèce;EUR;Euro;4591,00;4845,00;4917,00;5098,00;5221,00;5729,00;5391,00;5957,00;7316,00;7739,00;7707,00;7492,00;7402,00;7373,00;7557,00;7163,00;7441,00;7486,00;6607,00;7097,00;7501,00;7539,00;7794,00
D212;Impôts et droits sur les importations, à l'exclusion de la TVA;GRC;Grèce;EUR;Euro;79,00;79,00;74,00;83,00;160,00;154,00;360,00;347,00;250,00;286,00;153,00;180,00;108,00;205,00;190,00;347,00;320,00;374,00;337,00;414,00;356,00;296,00;348,00
D2_D5_D91_D611_D613;Total des impôts et des cotisations sociales;GRC;Grèce;EUR;Euro;53986,00;56135,00;58755,00;63240,00;67372,00;73683,00;76653,00;72792,00;72134,00;69461,00;68976,00;65065,00;64859,00;64887,00;68124,00;69912,00;72115,00;72024,00;64804,00;71779,00;84109,00;86736,00;94447,00
D59D;Paiements effectués par les ménages en vue de l’obtention de licences;GRC;Grèce;EUR;Euro;461,00;414,00;496,00;532,00;568,00;604,00;734,00;866,00;830,00;872,00;978,00;783,00;771,00;804,00;810,00;817,00;813,00;819,00;789,00;801,00;800,00;805,00;810,00
D214I;Impôts généraux sur les ventes ou le chiffre d'affaires;GRC;Grèce;EUR;Euro;309,00;317,00;353,00;318,00;823,00;509,00;737,00;474,00;546,00;530,00;489,00;507,00;555,00;192,00;115,00;101,00;97,00;84,00;83,00;131,00;233,00;230,00;178,00
D91A;Impôts sur les transferts en capital;GRC;Grèce;EUR;Euro;338,00;249,00;232,00;258,00;241,00;208,00;181,00;160,00;165,00;123,00;92,00;99,00;111,00;134,00;115,00;154,00;135,00;244,00;169,00;198,00;232,00;225,00;236,00
D2;Impôts sur la production et les importations;GRC;Grèce;EUR;Euro;21001,00;21680,00;22444,00;23632,00;26688,00;29241,00;30413,00;27826,00;28454,00;27971,00;27203,00;26615,00;28728,00;29137,00;30899,00;31221,00;31911,00;32270,00;27772,00;31408,00;39510,00;38430,00;40195,00
D51B;Impôts sur le revenu ou les bénéfices des sociétés non compris les gains de détention;GRC;Grèce;EUR;Euro;5355,00;4882,00;5259,00;6487,00;5552,00;5304,00;5188,00;5961,00;5717,00;4283,00;2088,00;2071,00;3349,00;3800,00;4388,00;3510,00;3998,00;3482,00;2350,00;3163,00;4628,00;6087,00;7111,00
D51;Impôts sur le revenu;GRC;Grèce;EUR;Euro;13018,00;12975,00;13922,00;16101,00;16100,00;17176,00;17632,00;17868,00;15953,00;14952,00;16229,00;14015,00;15212,00;14586,00;15634,00;15603,00;16468,00;15053,00;13412,00;14650,00;16912,00;20526,00;24085,00
ODD;Charges fiscales correspondant au produit total des impôts et cotisations sociales obligatoires après déduction des montants dus non recouvrables;GRC;Grèce;EUR;Euro;53986,00;56135,00;58755,00;63240,00;67372,00;73683,00;76653,00;72792,00;72134,00;69461,00;68976,00;65065,00;64859,00;64887,00;68124,00;69912,00;72115,00;72024,00;64804,00;71779,00;84109,00;86736,00;94447,00
D51E;Autres impôts sur le revenu n.c.a.;GRC;Grèce;EUR;Euro;669,00;778,00;717,00;895,00;1052,00;1318,00;1389,00;1285,00;1221,00;781,00;827,00;1164,00;1249,00;631,00;842,00;865,00;920,00;570,00;665,00;703,00;785,00;906,00;1074,00
ODC;Produit total des impôts et cotisations sociales nettes (y compris cotisations sociales imputées), après déduction des montants dus non recouvrables;GRC;Grèce;EUR;Euro;56378,00;58748,00;61826,00;66441,00;70913,00;77635,00;81308,00;77986,00;77086,00;74595,00;74665,00;70166,00;70372,00;70502,00;73719,00;75132,00;76941,00;76418,00;68890,00;75635,00;87964,00;90710,00;98378,00
D6112;Cotisations effectives autres que de pension à la charge des employeurs;GRC;Grèce;EUR;Euro;2860,00;3104,00;3166,00;3246,00;3025,00;3573,00;4073,00;3617,00;3960,00;3564,00;3316,00;3127,00;2799,00;2704,00;2705,00;2462,00;2763,00;2935,00;2770,00;3022,00;2952,00;2781,00;3159,00
D29A;Impôts sur les terrains, bâtiments et autres constructions;GRC;Grèce;EUR;Euro;344,00;371,00;377,00;446,00;603,00;630,00;696,00;704,00;446,00;742,00;806,00;785,00;3001,00;3318,00;3480,00;3491,00;3438,00;3110,00;2933,00;3065,00;3011,00;2967,00;2945,00
D2121;Droits sur les importations;GRC;Grèce;EUR;Euro;16,00;22,00;22,00;11,00;6,00;7,00;2,00;2,00;1,00;4,00;0,00;5,00;5,00;0,00;0,00;0,00;7,00;0,00;0,00;21,00;3,00;0,00;8,00
D214G;Taxes sur les primes d'assurance;GRC;Grèce;EUR;Euro;221,00;244,00;269,00;270,00;296,00;339,00;344,00;358,00;404,00;379,00;352,00;316,00;304,00;313,00;408,00;373,00;424,00;442,00;452,00;466,00;493,00;540,00;591,00
D59F;Autres impôts courants n.c.a.;GRC;Grèce;EUR;Euro;171,00;178,00;182,00;179,00;228,00;227,00;9,00;252,00;604,00;310,00;286,00;1264,00;129,00;60,00;16,00;9,00;9,00;26,00;13,00;12,00;14,00;7,00;6,00
D91;Impôts en capital;GRC;Grèce;EUR;Euro;376,00;291,00;324,00;394,00;325,00;303,00;614,00;524,00;250,00;250,00;161,00;162,00;137,00;166,00;136,00;179,00;160,00;270,00;191,00;230,00;262,00;259,00;268,00
D214E;Taxes sur les spectacles et divertissements;GRC;Grèce;EUR;Euro;8,00;8,00;6,00;7,00;9,00;8,00;8,00;9,00;9,00;4,00;5,00;6,00;4,00;3,00;0,00;0,00;0,00;0,00;0,00;0,00;0,00;0,00;0,00
D611;Cotisations sociales effectives à la charge des employeurs;GRC;Grèce;EUR;Euro;8584,00;9175,00;9357,00;10099,00;10173,00;11523,00;12212,00;11049,00;11456,00;9928,00;9270,00;8473,00;7985,00;7712,00;7716,00;8561,00;9572,00;10197,00;9730,00;11202,00;11567,00;11772,00;13002,00
D59A;Impôts courants sur le capital;GRC;Grèce;EUR;Euro;831,00;909,00;1018,00;1066,00;1113,00;1192,00;1265,00;1306,00;1295,00;2968,00;3187,00;2872,00;1307,00;1327,00;1316,00;1305,00;1308,00;1326,00;1275,00;1261,00;1425,00;1464,00;1495,00
D29F;Impôts sur les émissions polluantes;GRC;Grèce;EUR;Euro;6,00;32,00;34,00;39,00;38,00;17,00;17,00;17,00;127,00;99,00;636,00;1226,00;1270,00;1223,00;1210,00;1485,00;1100,00;1193,00;1060,00;1493,00;1722,00;1988,00;2191,00
D214;Impôts sur les produits à l'exclusion de TVA et des impôts sur les importations et les exportations;GRC;Grèce;EUR;Euro;8009,00;8515,00;8721,00;9009,00;10384,00;11148,00;10995,00;10194,00;10432,00;10301,00;9977,00;10012,00;9933,00;9514,00;9870,00;9587,00;10263,00;10557,00;8999,00;9627,00;14049,00;11807,00;11871,00
D214F;Taxes sur les loteries, les jeux et les paris;GRC;Grèce;EUR;Euro;120,00;106,00;126,00;135,00;104,00;95,00;114,00;96,00;92,00;82,00;82,00;100,00;42,00;6,00;4,00;3,00;4,00;5,00;4,00;0,00;1,00;2,00;1,00
D29B;Impôts sur l'utilisation d'actifs fixes;GRC;Grèce;EUR;Euro;60,00;60,00;79,00;54,00;157,00;159,00;181,00;174,00;3,00;3,00;7,00;8,00;9,00;6,00;5,00;3,00;4,00;3,00;3,00;3,00;4,00;4,00;8,00
D6132;Cotisations effectives autres que de pension à la charge des ménages;GRC;Grèce;EUR;Euro;2581,00;2928,00;2990,00;3134,00;3175,00;3518,00;3622,00;3304,00;3458,00;3290,00;3259,00;2943,00;3077,00;3235,00;3394,00;4360,00;4131,00;4025,00;4101,00;3828,00;4546,00;4234,00;4455,00
D29H;Autres impôts sur la production n.c.a.;GRC;Grèce;EUR;Euro;240,00;293,00;271,00;292,00;243,00;256,00;760,00;1027,00;785,00;872,00;1266,00;1003,00;919,00;1002,00;866,00;792,00;633,00;733,00;663,00;658,00;703,00;593,00;535,00
D211;Taxes du type TVA;GRC;Grèce;EUR;Euro;11972,00;12067,00;12578,00;13398,00;14755,00;16511,00;16978,00;14879,00;15958,00;15021,00;13713,00;12593,00;12676,00;12885,00;14333,00;14642,00;15288,00;15390,00;12925,00;15160,00;18621,00;19756,00;21384,00
D214L;Autres impôts sur les produits n.c.a.;GRC;Grèce;EUR;Euro;56,00;67,00;70,00;77,00;79,00;114,00;98,00;93,00;79,00;76,00;84,00;109,00;104,00;101,00;131,00;136,00;142,00;45,00;35,00;44,00;44,00;44,00;51,00
D51M;Impôts sur le revenu des personnes physiques ou des ménages y compris les gains de détention;GRC;Grèce;EUR;Euro;6955,00;7289,00;7916,00;8672,00;9448,00;10500,00;10997,00;10563,00;8948,00;9823,00;13242,00;10698,00;10536,00;10047,00;10320,00;11149,00;11427,00;10855,00;10309,00;10656,00;11382,00;13323,00;15554,00
D5;Impôts courants sur le revenu, le patrimoine, etc.;GRC;Grèce;EUR;Euro;14481,00;14476,00;15618,00;17878,00;18009,00;19199,00;19640,00;20292,00;18682,00;19102,00;20680,00;18934,00;17419,00;16777,00;17776,00;17734,00;18598,00;17224,00;15489,00;16724,00;19151,00;22802,00;26396,00
D6121;Cotisations de pension imputées à la charge des employeurs;GRC;Grèce;EUR;Euro;2392,00;2613,00;3071,00;3201,00;3541,00;3952,00;4655,00;5194,00;4952,00;5134,00;5689,00;5101,00;5513,00;5615,00;5595,00;5220,00;4826,00;4394,00;4086,00;3856,00;3855,00;3974,00;3931,00
D214B;Droits de timbre;GRC;Grèce;EUR;Euro;534,00;564,00;590,00;655,00;682,00;702,00;866,00;528,00;432,00;356,00;340,00;301,00;344,00;340,00;329,00;350,00;332,00;466,00;313,00;300,00;396,00;453,00;575,00
D51A;Impôts sur le revenu des personnes physiques ou des ménages non compris les gains de détention;GRC;Grèce;EUR;Euro;6955,00;7289,00;7916,00;8672,00;9448,00;10500,00;10997,00;10563,00;8948,00;9823,00;13242,00;10698,00;10536,00;10047,00;10320,00;11149,00;11427,00;10855,00;10309,00;10656,00;11382,00;13323,00;15554,00
D29E;Autorisations d'exercer des activités commerciales ou professionnelles;GRC;Grèce;EUR;Euro;291,00;263,00;310,00;311,00;348,00;366,00;426,00;484,00;453,00;647,00;645,00;808,00;812,00;984,00;945,00;874,00;865,00;910,00;852,00;988,00;1044,00;1019,00;913,00
D91C;Autres impôts en capital n.c.a.;GRC;Grèce;EUR;Euro;1,00;1,00;45,00;73,00;18,00;0,00;343,00;287,00;1,00;59,00;26,00;17,00;1,00;2,00;1,00;0,00;1,00;2,00;1,00;1,00;1,00;1,00;0,00
D214H;Autres taxes sur des services déterminés;GRC;Grèce;EUR;Euro;424,00;418,00;437,00;448,00;655,00;775,00;838,00;746,00;571,00;480,00;426,00;755,00;794,00;778,00;885,00;973,00;1247,00;1328,00;951,00;874,00;4452,00;1933,00;1544,00
D611C;Cotisations sociales effectives obligatoires à la charge des employeurs;GRC;Grèce;EUR;Euro;8584,00;9175,00;9357,00;10099,00;10173,00;11523,00;12212,00;11049,00;11456,00;9928,00;9270,00;8473,00;7985,00;7712,00;7716,00;8561,00;9572,00;10197,00;9730,00;11202,00;11567,00;11772,00;13002,00
D2122;Impôts sur les importations à l'exclusion de la TVA et des droits sur les importations;GRC;Grèce;EUR;Euro;63,00;57,00;52,00;72,00;154,00;147,00;358,00;345,00;249,00;282,00;153,00;175,00;103,00;205,00;190,00;347,00;313,00;374,00;337,00;393,00;353,00;296,00;340,00
D59;Autres impôts courants;GRC;Grèce;EUR;Euro;1463,00;1501,00;1696,00;1777,00;1909,00;2023,00;2008,00;2424,00;2729,00;4150,00;4451,00;4919,00;2207,00;2191,00;2142,00;2131,00;2130,00;2171,00;2077,00;2074,00;2239,00;2276,00;2311,00
D613CE;Cotisations sociales effectives obligatoires à la charge des salariés;GRC;Grèce;EUR;Euro;9544,00;10513,00;11012,00;11237,00;12177,00;13417,00;13774,00;13101,00;13292,00;12210,00;11662,00;10881,00;10590,00;11095,00;11597,00;12217,00;11874,00;12063,00;11622,00;12215,00;13619,00;13473,00;14586,00
D21;Impôts sur les produits;GRC;Grèce;EUR;Euro;20060,00;20661,00;21373,00;22490,00;25299,00;27813,00;28333,00;25420,00;26640,00;25608,00;23843,00;22785,00;22717,00;22604,00;24393,00;24576,00;25871,00;26321,00;22261,00;25201,00;33026,00;31859,00;33603,00
D61N;Cotisations sociales effectives des employeurs et des ménages;GRC;Grèce;EUR;Euro;18128,00;19688,00;20369,00;21336,00;22350,00;24940,00;25986,00;24150,00;24748,00;22138,00;20932,00;19354,00;18575,00;18807,00;19313,00;20778,00;21446,00;22260,00;21352,00;23417,00;25186,00;25245,00;27588,00
D6111;Cotisations de pension effectives à la charge des employeurs;GRC;Grèce;EUR;Euro;5724,00;6071,00;6191,00;6853,00;7148,00;7950,00;8139,00;7432,00;7496,00;6364,00;5954,00;5346,00;5186,00;5008,00;5011,00;6099,00;6809,00;7262,00;6960,00;8180,00;8615,00;8991,00;9843,00
D214C;Impôts sur les opérations financières et les opérations en capital;GRC;Grèce;EUR;Euro;971,00;1099,00;1018,00;1092,00;1591,00;1854,00;1773,00;1411,00;714,00;503,00;393,00;314,00;215,00;207,00;214,00;227,00;308,00;403,00;317,00;422,00;549,00;587,00;691,00
D995G;Impôts en capital dus non recouvrables;IRL;Irlande;EUR;Euro;0,00;0,00;0,00;0,00;0,00;0,00;0,00;0,00;0,00;0,00;0,00;0,00;0,00;0,00;0,00;0,00;0,00;0,00;0,00;0,00;0,00;0,00;0,00
D2122E;Impôts sur des services déterminés;IRL;Irlande;EUR;Euro;0,00;0,00;0,00;0,00;0,00;0,00;0,00;0,00;0,00;0,00;0,00;0,00;0,00;0,00;0,00;0,00;0,00;0,00;0,00;0,00;0,00;0,00;0,00
D2121;Droits sur les importations;IRL;Irlande;EUR;Euro;0,00;0,00;0,00;0,00;0,00;0,00;0,00;0,00;0,00;0,00;0,00;0,00;0,00;0,00;0,00;0,00;0,00;0,00;0,00;0,00;0,00;0,00;0,00
D995D;Autres impôts courants dus non recouvrables;IRL;Irlande;EUR;Euro;0,00;0,00;0,00;0,00;0,00;0,00;0,00;0,00;0,00;0,00;0,00;0,00;0,00;0,00;0,00;0,00;0,00;0,00;0,00;0,00;0,00;0,00;0,00
D214G;Taxes sur les primes d'assurance;IRL;Irlande;EUR;Euro;0,00;0,00;0,00;90,79;83,10;94,78;80,12;96,06;154,49;133,40;122,99;517,08;709,07;780,25;888,41;863,91;906,15;911,25;943,00;989,96;1000,32;1002,92;1051,76
D995B;Autres impôts sur la production dus non recouvrables;IRL;Irlande;EUR;Euro;0,00;0,00;0,00;0,00;0,00;0,00;0,00;0,00;0,00;0,00;0,00;0,00;0,00;0,00;0,00;0,00;0,00;0,00;0,00;0,00;0,00;0,00;0,00
D214I;Impôts généraux sur les ventes ou le chiffre d'affaires;IRL;Irlande;EUR;Euro;0,00;0,00;0,00;0,00;0,00;0,00;0,00;0,00;0,00;0,00;0,00;0,00;0,00;0,00;0,00;0,00;0,00;0,00;0,00;0,00;0,00;0,00;0,00
D995E;Cotisations sociales effectives à la charge des employeurs dues non recouvrables;IRL;Irlande;EUR;Euro;0,00;0,00;0,00;0,00;0,00;0,00;0,00;0,00;0,00;0,00;0,00;0,00;0,00;0,00;0,00;0,00;0,00;0,00;0,00;0,00;0,00;0,00;0,00
D59B;Impôts de capitation;IRL;Irlande;EUR;Euro;0,00;0,00;0,00;0,00;0,00;0,00;0,00;0,00;0,00;0,00;0,00;0,00;0,00;0,00;0,00;0,00;0,00;0,00;0,00;0,00;0,00;0,00;0,00
D2122B;Montants compensatoires monétaires prélevés à l'importation;IRL;Irlande;EUR;Euro;0,00;0,00;0,00;0,00;0,00;0,00;0,00;0,00;0,00;0,00;0,00;0,00;0,00;0,00;0,00;0,00;0,00;0,00;0,00;0,00;0,00;0,00;0,00
D995FS;Cotisations sociales effectives à la charge des travailleurs indépendants dues non recouvrables;IRL;Irlande;EUR;Euro;0,00;0,00;0,00;0,00;0,00;0,00;0,00;0,00;0,00;0,00;0,00;0,00;0,00;0,00;0,00;0,00;0,00;0,00;0,00;0,00;0,00;0,00;0,00
D2122D;Impôts généraux sur les ventes;IRL;Irlande;EUR;Euro;0,00;0,00;0,00;0,00;0,00;0,00;0,00;0,00;0,00;0,00;0,00;0,00;0,00;0,00;0,00;0,00;0,00;0,00;0,00;0,00;0,00;0,00;0,00
D6141;Suppléments de cotisations de pension à la charge des ménages;IRL;Irlande;EUR;Euro;0,00;0,00;0,00;0,00;0,00;0,00;0,00;0,00;0,00;0,00;0,00;0,00;0,00;0,00;0,00;0,00;0,00;0,00;0,00;0,00;0,00;0,00;0,00
D51D;Taxes sur les gains des loteries et des paris;IRL;Irlande;EUR;Euro;0,00;0,00;0,00;0,00;0,00;0,00;0,00;0,00;0,00;0,00;0,00;0,00;0,00;0,00;0,00;0,00;0,00;0,00;0,00;0,00;0,00;0,00;0,00
D29G;Sous-compensation de la TVA (régime forfaitaire);IRL;Irlande;EUR;Euro;0,00;0,00;0,00;0,00;0,00;0,00;0,00;0,00;0,00;3,33;4,73;4,67;4,68;5,68;6,13;6,33;6,82;7,05;6,83;7,30;7,45;7,42;7,50
D59E;Impôts sur les transactions internationales;IRL;Irlande;EUR;Euro;0,00;0,00;0,00;0,00;0,00;0,00;0,00;0,00;0,00;0,00;0,00;0,00;0,00;0,00;0,00;0,00;0,00;0,00;0,00;0,00;0,00;0,00;0,00
D59A;Impôts courants sur le capital;IRL;Irlande;EUR;Euro;0,00;0,00;0,00;0,00;0,00;0,00;0,00;0,00;0,00;460,03;482,93;568,06;792,14;216,84;46,82;47,72;48,27;47,41;48,29;55,20;50,06;56,49;57,48
D61SC;Rémunération du service des régimes d'assurance sociale (-);IRL;Irlande;EUR;Euro;0,00;0,00;0,00;0,00;0,00;0,00;0,00;0,00;0,00;0,00;0,00;0,00;0,00;0,00;0,00;0,00;0,00;0,00;0,00;0,00;0,00;0,00;0,00
D614;Suppléments de cotisations sociales à la charge des ménages;IRL;Irlande;EUR;Euro;0,00;0,00;0,00;0,00;0,00;0,00;0,00;0,00;0,00;0,00;0,00;0,00;0,00;0,00;0,00;0,00;0,00;0,00;0,00;0,00;0,00;0,00;0,00
D995F;Cotisations sociales effectives à la charge des ménages dues non recouvrables;IRL;Irlande;EUR;Euro;0,00;0,00;0,00;0,00;0,00;0,00;0,00;0,00;0,00;0,00;0,00;0,00;0,00;0,00;0,00;0,00;0,00;0,00;0,00;0,00;0,00;0,00;0,00
D91C;Autres impôts en capital n.c.a.;IRL;Irlande;EUR;Euro;0,00;0,00;0,00;0,00;0,00;0,00;0,00;0,00;0,00;0,00;0,00;0,00;0,00;0,00;0,00;0,00;0,00;0,00;0,00;0,00;0,00;0,00;0,00
D613V;Cotisations sociales effectives volontaires des ménages;IRL;Irlande;EUR;Euro;0,00;0,00;0,00;0,00;0,00;0,00;0,00;0,00;0,00;0,00;0,00;0,00;0,00;0,00;0,00;0,00;0,00;0,00;0,00;0,00;0,00;0,00;0,00
D995C;Impôts sur le revenu dus non recouvrables;IRL;Irlande;EUR;Euro;0,00;0,00;0,00;0,00;0,00;0,00;0,00;0,00;0,00;0,00;0,00;0,00;0,00;0,00;0,00;0,00;0,00;0,00;0,00;0,00;0,00;0,00;0,00
D51C3;Autres impôts sur les gains de détention n.c.a.;IRL;Irlande;EUR;Euro;0,00;0,00;0,00;0,00;0,00;0,00;0,00;0,00;0,00;0,00;0,00;0,00;0,00;0,00;0,00;0,00;0,00;0,00;0,00;0,00;0,00;0,00;0,00
D613CN;Cotisations sociales effectives obligatoires à la charge des personnes n'occupant pas d'emploi;IRL;Irlande;EUR;Euro;0,00;0,00;0,00;0,00;0,00;0,00;0,00;0,00;0,00;0,00;0,00;0,00;0,00;0,00;0,00;0,00;0,00;0,00;0,00;0,00;0,00;0,00;0,00
D995;Transferts en capital des administrations publiques vers les secteurs concernés correspondant à des impôts et contributions sociales notifiés mais non susceptible d'être perçus;IRL;Irlande;EUR;Euro;0,00;0,00;0,00;0,00;0,00;0,00;0,00;0,00;0,00;0,00;0,00;0,00;0,00;0,00;0,00;0,00;0,00;0,00;0,00;0,00;0,00;0,00;0,00
D995FE;Cotisations sociales effectives à la charge des salariés dues non recouvrables;IRL;Irlande;EUR;Euro;0,00;0,00;0,00;0,00;0,00;0,00;0,00;0,00;0,00;0,00;0,00;0,00;0,00;0,00;0,00;0,00;0,00;0,00;0,00;0,00;0,00;0,00;0,00
D611V;Cotisations sociales effectives volontaires des employeurs;IRL;Irlande;EUR;Euro;0,00;0,00;0,00;0,00;0,00;0,00;0,00;0,00;0,00;0,00;0,00;0,00;0,00;0,00;0,00;0,00;0,00;0,00;0,00;0,00;0,00;0,00;0,00
D995A;Impôts sur les produits dus non recouvrables;IRL;Irlande;EUR;Euro;0,00;0,00;0,00;0,00;0,00;0,00;0,00;0,00;0,00;0,00;0,00;0,00;0,00;0,00;0,00;0,00;0,00;0,00;0,00;0,00;0,00;0,00;0,00
D214K;Droits sur les exportations et montants compensatoires monétaires prélevés à l'exportation;IRL;Irlande;EUR;Euro;0,00;0,00;0,00;0,00;0,00;0,00;0,00;0,00;0,00;0,00;0,00;0,00;0,00;0,00;0,00;0,00;0,00;0,00;0,00;0,00;0,00;0,00;0,00
D29D;Impôts sur les transactions internationales;IRL;Irlande;EUR;Euro;0,00;0,00;0,00;0,00;0,00;0,00;0,00;0,00;0,00;0,00;0,00;0,00;0,00;0,00;0,00;0,00;0,00;0,00;0,00;0,00;0,00;0,00;0,00
D995FN;Cotisations sociales effectives à la charge des personnes n'occupant pas d'emploi dues non recouvrables;IRL;Irlande;EUR;Euro;0,00;0,00;0,00;0,00;0,00;0,00;0,00;0,00;0,00;0,00;0,00;0,00;0,00;0,00;0,00;0,00;0,00;0,00;0,00;0,00;0,00;0,00;0,00
D2122A;Prélèvements sur les produits agricoles importés;IRL;Irlande;EUR;Euro;0,00;0,00;0,00;0,00;0,00;0,00;0,00;0,00;0,00;0,00;0,00;0,00;0,00;0,00;0,00;0,00;0,00;0,00;0,00;0,00;0,00;0,00;0,00
D214J;Bénéfices des monopoles fiscaux;IRL;Irlande;EUR;Euro;0,00;0,00;0,00;0,00;0,00;0,00;0,00;0,00;0,00;0,00;0,00;0,00;0,00;193,37;218,96;226,75;224,65;250,66;270,32;289,71;258,30;241,01;238,34
D6142;Suppléments de cotisations autres que de pension à la charge des ménages;IRL;Irlande;EUR;Euro;0,00;0,00;0,00;0,00;0,00;0,00;0,00;0,00;0,00;0,00;0,00;0,00;0,00;0,00;0,00;0,00;0,00;0,00;0,00;0,00;0,00;0,00;0,00
D91B;Prélèvements sur le capital;IRL;Irlande;EUR;Euro;0,00;0,00;10,00;19,00;39,00;27,00;19,00;8,00;10,00;3,00;3,00;0,00;0,00;0,00;0,00;0,00;0,00;0,00;0,00;0,00;0,00;0,00;0,00
D59C;Impôts sur la dépense;IRL;Irlande;EUR;Euro;0,00;0,00;0,00;0,00;0,00;0,00;0,00;0,00;0,00;0,00;0,00;0,00;0,00;0,00;0,00;0,00;0,00;0,00;0,00;0,00;0,00;0,00;0,00
D2122F;Bénéfices des monopoles sur l'importation;IRL;Irlande;EUR;Euro;0,00;0,00;0,00;0,00;0,00;0,00;0,00;0,00;0,00;0,00;0,00;0,00;0,00;0,00;0,00;0,00;0,00;0,00;0,00;0,00;0,00;0,00;0,00
D613CSN;Cotisations sociales obligatoires à la charge des travailleurs indépendants et des personnes n'occupant pas d'emploi;IRL;Irlande;EUR;Euro;252,00;277,70;356,62;388,04;367,44;420,85;405,58;314,79;330,60;348,34;323,74;403,43;406,25;460,09;602,60;521,76;604,54;632,33;632,45;689,77;630,98;714,51;793,80
D212;Impôts et droits sur les importations, à l'exclusion de la TVA;IRL;Irlande;EUR;Euro;1820,64;1947,54;2539,21;2768,33;2986,71;3151,06;3099,96;3234,64;3009,41;3224,13;3137,48;3281,47;3342,74;3460,35;3595,85;3886,26;3311,52;3630,23;3381,02;3531,53;3146,88;3116,42;3369,75
D91;Impôts en capital;IRL;Irlande;EUR;Euro;151,73;213,73;200,45;273,69;354,72;432,19;367,61;265,92;245,12;245,18;284,83;278,43;358,53;400,85;410,65;448,36;518,34;530,70;504,96;581,94;614,76;633,79;853,86
D214B;Droits de timbre;IRL;Irlande;EUR;Euro;171,28;333,60;348,15;153,93;140,54;159,06;197,73;336,23;426,23;444,95;540,68;262,22;94,00;89,16;93,06;56,42;73,71;79,16;135,54;390,44;84,73;274,90;55,38
D613C;Cotisations sociales effectives obligatoires à la charge des ménages;IRL;Irlande;EUR;Euro;1506,03;1656,66;1951,87;2109,53;2088,28;2347,16;2454,54;3523,15;3525,74;3468,54;3361,97;3544,79;3602,52;3787,31;3841,80;3925,15;4367,47;4609,15;4397,97;4906,64;6050,14;6663,10;7265,87
ODA;Total des recettes fiscales;IRL;Irlande;EUR;Euro;32729,62;36008,88;40059,85;44394,66;50686,36;52374,01;45889,11;38729,91;37890,43;38875,44;40940,00;42519,06;46507,49;50749,87;52813,58;55718,94;60508,30;64605,16;61541,83;75709,41;88837,07;93594,38;102727,85
